label,question,syn_question
氣象局再發豪雨特報 縣市注意2019-05-18 19:49 中央社 台北18日電中央氣象局傍晚時05分發出豪雨特報報系資料 分享 facebook中央氣象局今天傍晚時05分發出豪雨特報超大豪雨地區南投縣豪雨地區包含台中市嘉義縣高雄市中央氣象局再度發出豪雨特報受西南風影響今天南投縣山區局部超大豪雨台中市山區嘉義縣山區高雄市山區局部豪雨南投縣平地苗栗縣山區雲林縣山區局部豪雨苗栗以南地區花蓮台東山區局部大雨發生機率氣象局提醒連日降雨山區慎防坍方落石土石流及溪水暴漲低窪處請慎防淹水,高雄桃源累積雨量破300毫米 區公所撤離里13002019-05-18 20:19 聯合報 記者 聯合報 記者 王昭月 即時報導高雄桃源那瑪夏兩處山區雨勢不斷桃源里24小時累積雨量超過300毫米桃源及勤兩個里達土石流紅色警戒桃源區公所今天傍晚點起強制撤離1300以策安全高雄市桃源山區昨晚起即滂沱大雨桃源里及勤里達土石流紅色警戒今天傍晚進行保全戶強制撤離桃源區公所應變中心表示雨勢昨天起下創天傍晚點左右稍趨緩造成勤和里避難屋聯外道路零星坍方桃源里及勤里土石流黃色警戒升級紅色警戒區公所強制將兩里民眾撤至桃源收容中心及勤避難屋,1
苗栗縣後龍鎮龍津里產業道路18日下午點多發生火燒車事件消防隊員獲報立即到場撲滅火勢車內無人未釀重大傷害但疑台中市沙鹿區茶藝館槍擊命案苗栗縣消防局下午點10分接獲民眾報案便派遣龍分隊前往灌救消防隊指出抵達現場時轎車全面燃燒火勢猛烈點50分左右才將大火撲滅因車內且附近無人不見該車駕駛人影便交由竹南警分局處理警方表示台中警方前來支援燒毀車輛疑似發生台中沙鹿區駭人茶藝館槍擊命案涉案車輛同一間租賃車公司將由台中警方全力追查中時 ,雲林縣北港鎮公民路棟民宅13日凌晨傳出火警起火點在樓屋內受困高層樓警消獲報立即出動雲梯車救援順利救出所有人屋主事表示擔任過義消家人高層樓待援幸運毫髮未傷獲救北港鎮公民路棟層樓民宅樓13日凌晨點許突然冒出濃煙住樓屋主睡夢中驚醒無法判斷樓火勢大小報警通知家人高層樓等待救援走樓頂樓見樓濃煙密布走出房間可能危險決定樓陽台待援雲林消防局獲報立即派遣北港水林元長消防分隊出動消防車雲梯車救護車共10輛人員20名由小隊長鄭文展帶隊救援抵達火場時樓不斷濃煙受困屋內消防人員用水柱控制火勢出動雲梯車將受困樓陽台救出頂樓人則消防人員引導隔壁樓逃出驚嚇驚魂未定均沒受傷消防人員事進入現場勘災初步研判起火點位樓廚房雲林縣消防局大隊長陳岳謄表示屋主得知起火帶家人高層樓待援避免強行闖出火場造成受傷可能性呼籲民眾面火災不要驚慌火勢尚小可考慮衝出火場若無法判斷火勢最好高層樓待援,0
聖暉5536今年首季繳出一張亮眼成績單EPS高達4.33元15日早盤一開盤湧入買盤盤中最高漲幅逾聖暉表示美中貿易戰導致遞延訂單預估約～季度聖暉多元工案穩定接單目前聖暉在建工程超過100億元今年營運相穩健聖暉表示未來將由工業工藝延伸民生工業成為更多元應用今年第一季新接單約40～50億元台北高階辦公大樓新訂單超過10億元預估完工時間兩年半南科案主係受惠台商回流中美貿易戰高關稅影響聖暉台及東南亞業務發展開啟機會這也聖暉長期佈局下斬獲聖暉2019年第一季合併營收27.6億元年減稅後淨利2.94億元年增25稅後淨利歸屬母公司業主2.34億元年成長17.7EPS高達4.33元聖暉表示第一季營收雖然略減小型工案週轉快毛利率高及匯率因素第一季獲利逆勢成長工商 ,"力山1515首季獲利優預期10日股價開高走高但盤中下殺震盪整理尾盤拉高收76.6元上漲2.7元成交爆量,417張成功站上日均價因委賣委買挑戰月線均價備受關注力山10日大盤拖累股價最高80元最低74.8元KD向上似有轉強跡象在外資10日賣超906張市值得觀察力山今年營運轉強第一季稅後淨利8.28億元暴增58.57倍EPS4.56元遠優去年同期0.08元力山前四月合併營收26.42億元年增93.5",0
去年大力協助韓國瑜選高雄市長楊秋興最近炮轟韓落跑欺騙楊16日為詐欺說致歉重申韓國瑜留高雄郭台銘選總統100分韓國瑜則說楊秋興千萬不要道歉政治一時朋友永久不會在意楊秋興昨上午表示期待韓市長留在高雄算是回報高雄市民期待支持他並重提當初沒想到韓國瑜會選總統先前詐欺共犯形容韓國瑜選總統楊秋興坦言用詞過重過當我表達歉意韓國瑜接受媒體聯訪表示尊重楊秋興縣長論述覺得楊千萬不要道歉追求人生更審慎目標更高尚目標其實每個政治人物應該謹記心部分韓粉發起募款韓籌措500萬元選務作業費韓國瑜昨嚴正聲明千萬不要希望造成民眾困擾經濟負擔有人要用名義募款拜託今天停止非常不好,高雄市長韓國瑜話題不斷近來市政會議表現日前拋出總統高雄辦公言論隨後又有民調顯示韓國瑜支持度下降10-11%更引起外界討論其聲勢是否下滑憂慮對此文化大學教授鈕則勳語重心長表示面對議員攻擊性質詢韓國瑜應該沉住氣不要一直重複高雄發大財否則易這句話變得廉價影響韓國瑜聲勢鈕則勳接受寰宇新聞網專訪時表示近來媒體民調顯示韓國瑜支持度大約掉10-11%左右紐則勳指出現在很多議員透過挑釁式攻擊性方式進行質詢韓國瑜議員戰術激怒易失去一個市長高度鈕則勳並表示本來高雄發大財期許當韓國瑜一種負氣帶有怒氣不斷重複高雄發大財這句話時會覺得高雄發大財好像變得非常廉價成一個笑話韓國瑜大眾覺得高雄發大財一樁笑話時恐進一步導致韓國瑜神話破滅中時電子報,1
中國時報今以滅賴三部曲報導民進黨總統黨初選之爭賴清德發言人林聖哲則說希望媒體報導真的圖為賴清德左資料記者楊淳卉台北報導中國時報今以滅賴三部曲報導民進黨總統黨初選之爭總統蔡英文2020初選發言人阮昭雄表達強烈抗議要求媒體道歉更正賴清德發言人林聖哲則說希望媒體報導真的中國時報報導民進黨挺英派展開滅賴三部曲斬斷後路曝光支持者號令蔡粉致電施壓表態逼迫賴走進孤立無援絕境最後再透過手機民調清理戰場打包賴清德林聖哲表示希望媒體報導真的並說這是一場黨初選初選結束團結這才典範君子之爭,蔡英文總統右二參加美超微電腦公司亞太科技園區第二期廠房擴建動土典禮記者周敏鴻攝記者周敏鴻桃園報導前行政院長賴清德提及若為早2016年參選說法蔡英文先質疑剛選完連任強調評論蔡英文強調團結意志一加一定能大二蔡英文上午前往桃園市參加美超微電腦公司亞太科技園區第二期廠房擴建動土典禮詢及對賴清德說法回應強調一加一大二支持者普遍期待希望團結意志底下集結眾力量讓民進黨2020年大選更好勝算70位台灣民眾香港遣返香港抗議問題蔡英文說香港抗議活動一再發生透露一國兩制香港香港人來說最喜歡接受方案香港決定生活方式政府體制重要事情證明一國兩制一國一制不能台灣選項台灣海峽國船艦蔡英文說台灣海峽國際水域各國船艦各國船艦尤其軍艦時國軍都會全程掌握緊密完整正確掌控情況,0
"益登3048公布今年第一季財報基本每股盈餘EPS0.09元去年同期0.22元然今年每股擬配發現金股利0.7元14日收盤價13.3元計算殖利率高達5.26三大法人14日翻外資及自營商聯手買超25張益登首季合併營收達174.8億元季減15.35年減6.45單季稅前淨利達,512萬元稅後淨利則達,961萬元去年同期衰退約59.01公司強調今年全球經濟情勢存在確定因素益登將藉由多元化布局以開拓市場商機持續強化供應鏈管理提升整體營運效率展望第二季益登將持續耕耘通訊資料中心雲端運算邊緣運算物聯網工業汽車人工智慧新興市場強化電源管理音訊應用領域投入提供完整產品解決方案和服務工商 ","力山1515首季獲利優預期10日股價開高走高但盤中下殺震盪整理尾盤拉高收76.6元上漲2.7元成交爆量,417張成功站上日均價因委賣委買挑戰月線均價備受關注力山10日大盤拖累股價最高80元最低74.8元KD向上似有轉強跡象在外資10日賣超906張市值得觀察力山今年營運轉強第一季稅後淨利8.28億元暴增58.57倍EPS4.56元遠優去年同期0.08元力山前四月合併營收26.42億元年增93.5",0
電梯大廠永大機電第一季因大陸事業處低檔且發生虧損台灣電梯事業獲利彌補本期淨利1.44元EPS去年同期0.88元降0.33元永大新任董事長許作名13日董事會報告第一季大陸事業今年低潮月訂單好轉訂單慢慢回升今年大陸事業會艱困一年2020年轉虧為盈永大今13日董事會承認第一季財報大陸電梯出貨還在低檔合併營收遽降至31.76億元藉台灣電梯市場銷售獲利穩定成長彌補大陸事業虧損部分營業毛利7.68億元營業利益2.05億元稅前淨利2.35億元本期淨利1.44億元歸屬母公司業主淨利為1.36億元EPS0.33元工商 ,"力山1515首季獲利優預期10日股價開高走高但盤中下殺震盪整理尾盤拉高收76.6元上漲2.7元成交爆量,417張成功站上日均價因委賣委買挑戰月線均價備受關注力山10日大盤拖累股價最高80元最低74.8元KD向上似有轉強跡象在外資10日賣超906張市值得觀察力山今年營運轉強第一季稅後淨利8.28億元暴增58.57倍EPS4.56元遠優去年同期0.08元力山前四月合併營收26.42億元年增93.5",0
新北市樹林區鎮前街保安街一段交叉路口下午時許柏油路面突然爆裂大量積水湧出路面無人傷亡警消初步研判地下管線破裂影響範圍約寬12公尺長30公尺深15公分目前地面嚴重積水雙向道路暫時封閉由區公所自來水公司搶救中中時 ,國民黨基隆市立委選舉請假參選主委黃希賢前議員韓良圻議員藍敏煌宋瑋莉角逐市黨部15日舉辦協調會決定辦理初選採由全民調提名並委託全國公信力典通及艾普羅家民調公司月日連續天進行辦政見說明會最遲將月12日國民黨中常會公布人選國民黨基隆市黨部今日召集名參選人進行協調討論辦理民調日期機構黃希賢有事派代表參加眾人決議採全民調並從家民調公司中勾選決定全國公信力典通及艾普羅家民調公司為委託單位安排月日舉行採電話訪問任意成人協調會決議不辦理政見說明會全民調舉行完畢市黨部會將協調報給黨中央最遲將會月12日中常會中公布提名人選中時 ,0
108年國中教育會考18日登場嘉義考區7352報名試場筆試共有12違規包括名考生攜帶小米智慧手機環應考名考生鈴響繼續作答市長黃敏惠巡視考場送扇子考生及家長加油打氣嘉義區考場分設嘉義女中嘉義高工嘉義高中民雄農工東石高中黃敏惠巡視嘉女嘉工及嘉中考場慰勉陪考家長老師們辛苦感謝監考老師試務工作人員犧牲假期協助試務工作送畫家SMART設計智慧扇考生加油中時 ,嘉義縣家無現金支付超商16日上午嘉義縣政府地下室開幕縣府將嘉義縣農特產也納入超商商品中ok超商總經理魏國志表示初期先以實驗方式試賣嘉縣農特產品台監控銷售數字若銷量續考慮縣府合作超商上架昨日上午嘉義縣長翁章梁ok超商總經理魏國志縣府地下室一樓全嘉義縣間mk mini智能便利店揭幕翁章梁現場試買包零食現場縣府員工排隊試買販賣機內項嘉縣農特產品魏國志表示目前全台約近300家智能便利店未來縣府一起推進智慧城市使用支付方式高達20多種line payi cash外幾乎使用嘉義縣老年人口比例高魏提到觀察到長輩使用方便正在陸續研發適合銀髮族自動販賣機翁章梁指出現在買東西不用帶錢越來越方便縣府響應中央推動2025年行動支付普及率達90目標引進OK mini無現金交易自動販賣機未來將媒合農會超商合作將嘉義縣農特產品放到全國OK mini販售藉此將嘉義農特產品行銷到全國,0
外媒劉揚偉接替郭台銘 將任鴻海董事長2019-05-13 12:40 聯合報 記者 聯合報 記者 蔡敏姿 即時報導路透報導兩名知情人士表示鴻海S次集團總經理劉揚偉將出任董事長接替郭台銘劉揚偉富士康日本電子子公司夏普公司董事鴻海公布新任董事名單郭台銘呂芳銘劉揚偉李傑盧松青及戴正吳三名獨立董事王國城郭大維及龔國權擬設立新董事會須經股東月舉行會議批准選出董事長外界猜測未來鴻海董事長人選呂芳銘及劉揚偉呼聲高呂芳銘為鴻海集團副總裁兼亞太電信董事長劉揚偉聯電旗下聯陽美國子公司擔任副總經理美國南加州創業成立主機板公司賣給鴻海做過IC設計普誠總經理熟悉半導體PC通訊領域12年前郭台銘延攬到鴻海集團擔任特助如今有望成為鴻海最年輕董事長鴻海集團董事長郭台銘將角逐2020總統大選11日表示國民黨總統初選沒過絕對不會回去董事長,偏光片生意難做 明基材看好新事業2019-05-13 14:30 聯合晚報 記者 聯合晚報 記者 蔡銘仁 台北報導偏光片擴產速度跟不上面板廠2019年偏光片廠供給皆緊刺激價格長年疲弱偏光片醞釀漲價偏光片價格可望喊漲明基材8215董事長陳建志清楚偏光片生意不好做明基材近年積極衝刺新事業設法降低偏光片所帶淡旺季影響明基材跨足醫材隱形眼鏡新事業致力成為多元產品製造商醫材部分明基材皮膚護理品牌護妍天使隱形痘貼中國大陸東南亞為第一品牌傷口護理品牌安適康止血產品打進中國市場新負壓傷口治療系統預計今年台銷售隱形眼鏡美若康台市占率5%進軍中國新加坡香港市場明基材發展新事業超過六年醫材事業去年已處獲利陳建志看好新事業有望成為明基材未來獲利動希望2020年新事業占比能過半偏光片事業明基材現行方針增加高附加價值產品比重協助客戶轉型陳建志日前表示過度擴產環境機會扶植客戶做面板多元應用重點,0
台灣觀光遊客很多亞洲國家少數而亞洲外表其實西方人感覺一點其實日本香港韓國大陸人講話常常會猜不到亞洲國家那要分辨妹子台灣人大陸流行趨勢越來越走路上光靠女生打扮一定分辨網友在網路上問說觀光景點常看到自由行大陸人覺得大陸女生台灣女生其實不難分辨知道差雖然現年輕人穿搭相似整體感覺不太一樣想問一下判斷想不到網友討論意外熱烈通常認為講話難判斷講話很難韓國人日本大致五官有點差異氣質太專業觀察過網友說打扮化妝其實明顯更偏韓系大陸女生口紅擦很紅眉毛化劍眉妝容比台灣豔麗很多台灣女生更韓系尤其口紅,常常會聽很多幽默說正妹連流汗香認為正妹流汗外表看起不狼狽沒有汗味之外還會散發香氣現在節目找正妹實際測量正妹流汗到底是不是香1998出生日本將棋女流棋士竹俣紅たけまた べに10歲時拿下日本將棋聯盟舉辦回駒姫名人戰優勝打開知名度外表出眾偶爾會電視通告節目或公開出席將棋場合獲得不少民眾喜愛日本節目找竹俣紅實測狐臭問題測量分為汗臭中年脂肪臭味老人味部分接著將測量機器放在腋下竹俣紅測量分數高達43分汗臭味分數最高兩樣影響說標準青春茂盛會汗味測量竹俣紅節目中立刻訓斥沒好好洗澡這項測驗正妹連流汗香幻想破滅網友不服氣表示正妹汗味香說正妹不會理儀器應該壞掉正妹應該香喜歡聞正妹汗味,0
立法院今日討論法官法修法法官協會發表聲明表示司法審判服務業上訴不要客訴不要法官審判被告群眾公審法官立法院堅持當事人直接請求評鑑法官修法應訂配套措施降低司法審判獨立負面衝擊法官協會指出法官中立第三者雙方當事主張證據依法審判訴訟當事犯罪被害人判決不服依法提起上訴以資救濟司法審判並服務業可能討好每位顧客當事人法官協會表示判決必有勝敗更可能每位人民滿意當事人犯罪被害人直接客訴請求評鑑法官會評鑑制度淪為有心人士不當干擾司法公正審判獨立手段更可能大量濫行評鑑請求而排擠真正需要進行評鑑案件審查法官協會表示修法當事人被害人直接請求評鑑毫無限制擴張請求評鑑團體形同法官審判被告群眾公審法官荒謬現象立院執意修法主管機關應訂定相關配套措施充分徵詢法官群體意見降低司法公正審判獨立負面衝擊中時 ,台北高等行政法院審理公教退休年改共有名法官因認去年月日起實施公教退休優惠存款退休所得率相關規定違反法律不溯信賴保護原則財產權保障違憲之虞裁定停止審理聲請大法官會議解釋立委林德福人針公教年改聲請案大法官決定受理並在15日憲法法庭召開類似準備程序說明會行政院考試院代表聲請者立委退撫新制各爭點提出法律意見大法官進行提問去年12月大法官會議已針呂玉玲立委聲請軍改召開說明會立委林德福李鴻鈞高金素梅公務員教師年改提出聲請案大法官會議15日分成上午場及下午場展開全天馬拉松式說明會民眾申請旁聽中時 ,0
甘比曬全家福照片圖翻攝kimbeechanofficial IG身家千億香港富商劉鑾雄大劉2016年妻子甘比結婚最近港媒報導劉鑾雄過涉賄賂案最近港澳之間修訂引渡條例傳大劉可能面臨牢獄之災分起家產對此提出司法覆核自保引發外界議論甘比稍早分享全家照片疑回應家中生活依舊平靜幸福劉鑾雄年前登報分手一號女友呂麗君並和二號女友甘比結婚生下一兒一女則生一兒兩女婚後甘比大劉手上得到價值10億港幣房產180億港幣商場加上現金股份外界粗估甘比身家超過600億成為新一代香港女首富新浪娛樂報導劉鑾雄2014年一起賄賂官員案被判有罪劉鑾雄健康拒絕澳門服刑引渡條款修正恐將被關傳聞大劉近日忙分配家產而港媒報導大劉提出司法覆核盼以此脫離引渡可能性甘比今IG分享全家福分享月復活節時帶小孩到倫敦參觀車路士球場多倫多兩天探望姑姐指劉鑾雄妹妹孩子仍然懷念著姑姐招待最後強調感恩一家人聚在一起開心中時電子報,香港富商劉鑾雄大劉坐擁約台幣4000億身家年前登報分手一號女友呂麗君並與二號女友甘比登記結婚成為一時熱議話題20日港媒爆料劉鑾雄現身一處商城身為多金名人竟一名短裙少女當街大吵原來方忙滑手機疑似撞大劉子女劉發飆香港蘋果日報報導前天下午大劉老婆甘比小孩商場逛街期間出現一名短裙少女疑因玩手機擋住手扶梯碰撞劉的孩子劉便暴怒開罵少女回嗆積福劉則爆粗口回應積福積老母並問少女小孩受傷辦賠眼見劉鑾雄公眾場合氣炸體貼甘比便出聲頻頻安撫老公鬧劇落幕傳聞網友評論正反兩極網友覺得劉沒風度有人認為劉鑾雄善盡父親責任父親遇到這情況可能發飆有人覺得行人太愛邊走邊滑手機這習慣太差該名少女檢討中時電子報,2
櫃買中心13日表示新鉅科股票3630月14日起預收款券並五分鐘撮合一次新鉅科股票最近10營業日營業日經櫃買中心公布注意交易資訊月14日起10營業日月27日止改人工管制撮合終端機執行撮合作業約五分鐘撮合一次各證券商投資人每日委託買賣價證券數量單筆達10交易單位筆累積達30交易單位時應當日已委託買賣投資人收取之買進價金賣出證券信用交易部分收足融資自備款融券保證金工商 ,衣新舊人際關係磁場十分活絡本周大利出席老朋友聚會理念相同人脈更需要用心經營愛情磁場依舊理想已有伴侶摩羯更需要珍惜愛人貴人工作運勢亦佳突任務宜以機會解讀投資求財務實宜按部就班為佳幸運物色彩碧璽紅色幸運數字組合,0
月球內部冷其外殼逐漸縮有如新鮮葡萄時間推移變成葡萄乾過程情境圖擷取自NASANASA指出月球內部冷其外殼逐漸縮有如新鮮葡萄時間推移變成葡萄乾過程柔韌葡萄皮不同月球表層硬且脆將隨著月亮收縮破裂進而行成逆衝斷層一部份地殼將推到相鄰部分上方美國史密森尼學會旗下國家航太博物館Smithsonian’s National Air and Space Museum行星研究中心高階科學家華特斯Thomas Watters表示機構分析月表斷層依舊活躍可能月球持續冷縮小時引發月震說部分月震強度可能相當強高達芮氏規模國氣象局定義已達強震等級早多年前科學家注意月球縮小狀況正常物理現象速度極為緩慢地球幾無影響並不受太多關注未來日益頻繁月震是否登月任務造成影響建立月球基地構成潛威脅仍待科學家進一步研究還想更新聞現在ＡＰＰ看新聞還能抽獎,菲律賓今天上午發生芮氏規模5.7強震擷取自USGS即時新聞綜合報導菲律賓上月底遭規模6.16.3強震侵襲共造成超過10死亡今天上午發生芮氏規模5.7強震震源深度僅10公里屬極淺層強震目前災情未明美國地質調查局USGS公布觀測數據台灣時間今天上午時05分許菲律賓西北部卡拉棉群島西方近海發生芮氏規模5.7地震震央位北緯12.3度東經120.9度震源深度僅10公里國氣象局定義已達極淺層強震等級還想更新聞現在ＡＰＰ看新聞還能抽獎,0
記者吳昇儒基隆報導基隆一名李姓少婦27日上午時許家中丈夫發生爭執外出飲酒隨後搭計程車八斗子漁港準備輕生計程車司機認乘客情緒穩定頻頻搭車漁港擔心發生意外直接將人載派出所女警湯惠婷詢問慢慢開導所內警犬皮皮上前李女撒嬌賣萌心情好轉打消輕生念頭交由丈夫接回載到李女計程車司機直接將車開往二分局八斗子分駐並向值班人員表示車內女乘客喝多情緒非常穩定一直要求將車開到八斗子漁港擔心會做傻事先到派出所求援女警湯惠婷聞訊先請26歲李女派出所休息區詢問得知丈夫發生爭執情緒激動想要輕生湯員見李女心情抑鬱慢慢勸警犬皮皮幫忙李女心情好轉警方見狀立刻通知李女丈夫接人李女回家休息女警湯惠婷警犬皮皮一起開導李女記者吳昇儒翻攝女警湯惠婷警犬皮皮一起開導李女記者吳昇儒翻攝,［記者王秀亭台東報導］台東市今天中午傳出女子墜樓意外台東縣消防局今天中午獲報台東市夫妻住家吵架女子從三樓墜落掉落二樓間遮雨棚造成頭部撕裂傷送醫後無礙陪同就醫家屬表示擦樓玻璃時小心墜落台東縣消防局接獲民眾通報台東市民宅夫妻吵架有人從三樓墜落卡在二樓陽台立刻趕抵抵現場發現一名女子躺二樓間遮雨棚頭部撕裂傷而流血救護人員不敢大意消防車停該棟民宅前消防車直接爬遮陽棚進行救護30歲陳姓女子已長背板固定再經消防車移至道路救護車送往台東馬偕醫院進一步治療陪同陳女醫的家屬面外傳夫妻吵架說法直接否認指稱陳女樓陽台坐在坐在玻璃窗框上擦玻璃時一個小心跌落救護人員遮雨棚將陳女包紮固定記者王秀亭翻攝救護人員利用消防車將陳女由二樓遮雨棚送往一樓記者王秀亭翻攝,0
