label,question,syn_question
"韓國瑜說Yes, I do回家佳芬姐說話2019-05-17 23:22 聯合報 記者 聯合報 記者 徐白櫻 即時報導高雄市長韓國瑜今天接受中天電視台專訪明確表態說若國民黨人小組徵詢參選總統意願他會回說Yes, I do我願意主持人王正追問不知妻子李佳芬會看待話說韓笑回說肉麻話說出口會直接告訴說決定幹追隨我主持人王正問韓國瑜上次講Yes, I do這句話是否是婚禮佳芬姐說話韓回說其實說Please, don’t do me like that.拜託不要凶Yes, I do韓國瑜說家萬事興妻子顧慮一定希望老公健康希望老公健康垮掉北農時期白白胖胖雙眼炯炯發光印堂發亮可說翩翩美男子年後變垂垂老矣精氣神嚴重受傷家裡外面角度不同最終一句話進廚房不能怕熱人生選擇",韓國瑜批民進黨 選票中南部但心中南部2019-05-17 21:13 聯合報 記者 聯合報 記者 楊濡嘉 即時報導高雄市長韓國瑜接受中天電視新聞深喉嚨專訪時說民進黨選票中南部但心中南部國民黨不團結必敗韓國瑜說參選一系列一個重點高雄市民交代市長月看到南台灣的生命力沒有放出高雄時小媳婦一句話不要重北輕南北部當官思維可能只給一點預算說民進黨選票中南部但心中南部南台灣經濟可能從雲林以南沒有一國際機場資源生命力沒開發外國人台北台灣高雄關注度不夠去年全世界高雄高雄來選一位不一樣市長不一樣故事引起國際人士高雄觀光發現連一個國際機場沒南台灣是一階段台澎金馬發展重點國民黨擬參選者韓國瑜認為國民黨團結不見得贏不團結必敗這是整個中華民國生死存亡之戰抬高高度君子之爭大局著想高度一直黑未告一人,0
AAE執行長大衛‧馬丁左韓國瑜一起受訪圖擷自直播畫面高雄市長韓國瑜昨日自爆美國漫威公司想奮鬥過程變成漫畫市府證實前漫威成員現為AAE執行長大衛‧馬丁David Martin拜會韓國瑜這起漫威烏龍事件大衛‧馬丁今天下午韓國瑜陪同出面說明大衛‧馬丁指出公司創造英雄原型韓國瑜身上看到英雄故事韓國瑜一個平凡變成城市領袖希望這事蹟變成一部漫畫做全球發行希望透過漫畫學習韓國瑜奮鬥人生態度韓國瑜烏龍事件表示大衛‧馬丁昨天突然他講嚇一跳大衛‧馬丁覺一個賣菜郎離開政壇很多年突然選上市長他覺變成漫畫韓國瑜澄清昨天採訪時把畫拿出原本並沒有公開公布脫口出漫威要出漫畫韓國瑜表示清楚公司漫威垂直整合水平整合顯然相當多業務共同蜘蛛人蝙蝠俠綠巨人浩克開心接受沒有想法中時電子報,韓國瑜戰綠議員 甩無理要求重砲反擊高雄市議會昨日場面火爆民進黨議員康裕成用橋頭科學園區為題連番轟炸高雄市長韓國瑜短短十分質詢韓國瑜一下坐一下站共達18次而康挑釁語氣更韓國瑜動怒直言根本故意漏氣韓國瑜昨到議會備詢質詢橋頭科學園區問題時康裕成要求採一問一答方式要求韓國瑜站答詢短短十分質詢韓國瑜一下坐一下站共達18次康裕成幾近無禮質詢韓國瑜不甘示弱數度經發局伏局長回答回答雙方氣氛非常火爆質詢完幾名民進黨議員走向韓國瑜握手正在氣頭韓國瑜拒絕起身解釋講沒兩句議員集體走韓國瑜事後受訪表示巿政府一定尊重巿議會巿議員質詢一連串設計急著巿長漏氣心情建設高雄心情這是怪異中時電子報,0
櫃買中心17日表示相關規定每年均會公司申報財報定期檢討上櫃公司產業類別營業務性質改變經營策略調整之上櫃公司重新調整其產業類別原證券代號不變108年度共有家上櫃公司調整產業類別並自108年月日起實施創新新零售公司股票代號3085資訊服務業調整電子商務業東浦精密光電公司股票代號3290通信網路業調整電子零組件業御頂國際公司股票代號3522光電業調整觀光事業慕康生技醫藥公司股票代號5398電子零組件業調整業上揚科技公司股票代號6222電腦週邊設備業調整光電業長華科技公司股票代號6548光電業調整半導體業工商 ,新北市樹林區鎮前街保安街一段交叉路口下午時許柏油路面突然爆裂大量積水湧出路面無人傷亡警消初步研判地下管線破裂影響範圍約寬12公尺長30公尺深15公分目前地面嚴重積水雙向道路暫時封閉由區公所自來水公司搶救中中時 ,0
氣象局再發豪雨特報 縣市注意2019-05-18 19:49 中央社 台北18日電中央氣象局傍晚時05分發出豪雨特報報系資料 分享 facebook中央氣象局今天傍晚時05分發出豪雨特報超大豪雨地區南投縣豪雨地區包含台中市嘉義縣高雄市中央氣象局再度發出豪雨特報受西南風影響今天南投縣山區局部超大豪雨台中市山區嘉義縣山區高雄市山區局部豪雨南投縣平地苗栗縣山區雲林縣山區局部豪雨苗栗以南地區花蓮台東山區局部大雨發生機率氣象局提醒連日降雨山區慎防坍方落石土石流及溪水暴漲低窪處請慎防淹水,全台豪雨大雨特報注意瞬間大雨雷擊強陣風2019-05-18 13:16 聯合報 記者 聯合報 記者 吳姿賢 即時報導中央氣象局發布豪雨大雨特報西南風影響今日南投縣山區嘉義縣山區局部豪雨豪雨苗栗縣山區台中市山區雲林縣山區高雄市山區局部豪雨西半部東北部地區花蓮台東山區局部大雨發生機率請注意瞬間大雨雷擊強陣風山區慎防坍方落石土石流及溪水暴漲低窪處慎防淹水,2
國民黨台南市議員蔡育輝蔡淑惠李中岑13日聯合質詢時要求市府編列預算全額補助全市國中小營養午餐減輕家長負擔提高生育率概算每年經費將增加億8393萬多元市長黃偉哲答詢表示經費太高無力全額支付願意低收及中低收全額補助蔡育輝指出目前台南市國中萬1000每人每月收費700825元國小萬6728每人每月收費680795元目前台南市接受補助弱勢學生1.5萬人共補助億3782萬元蔡育輝還說目前市府每年編列營養午餐預算約1.8億元教育部補助1.5億元市府支付3000萬元未來全市國中小學生營養午餐免費國中預定增加億5228萬3000元國小增加億3164萬8000元合計增加億8393萬1000元蔡育輝強調台南市2018年人口出現負成長勢將造成日台南捷運營運更加困難市府開辦免費國中小營養午餐即可減輕家長負擔打造幸福城市還能提高生育率中時 ,營養師需要執照執業且錄取率每年約10非常難考考上學校營養師開缺少桃園市目前50位校園營養師29位正職21位約聘教育局表示逐年將約聘轉為正職外依學校狀況每年開缺人數一定受少子化影響40班學校越來越少開缺勢必減少營養師執照難考醫院學校營養師工作錢少事了解校園營養師庶務繁雜正職薪水約萬5000元隨資歷往增加約聘更少約萬多元目前執業營養師沒有原因很多根本找不到工作營養師人數問題端看學校沒開缺約聘營養師編制營養師相較工作保障流動性高有家長擔心學童營養食安造成影響教育局對此表示今年位約聘營養師轉正職續依此模式逐年改善今年大溪國小永安國中等校都開營養師缺希望未來預算充裕情況逐年補足缺額,0
南投濁水溪暴漲 國道號10工人受困溪床2019-05-18 19:42 聯合報 記者 聯合報 記者 江良誠 即時報導南投縣今天降下豪雨下午點45分國道三號竹山路段10名工人正在進行橋梁耐震補強作業沒想到濁水溪溪水暴漲導致工人受困竹山警分局獲報通報南投縣消防局救援並請集集攔河堰暫停放水水位降低挖土機接駁方式10名工人救回岸上化解危機國道高速公路局最近正在國道三號進行濁水溪河川橋竹山排水橋國里程241k+000249k+900橋梁合計共14座橋梁補強作業補強內容包括增設混凝土止震塊鋼止震裝置中空柱灌混凝土橋墩包覆補強基礎補強降低液化之潛能改變橋梁結構系統耐震補強作業沒想到今天大雨造成山區道路坍方土石流下午濁水溪溪水暴漲導致國道施工工人不及撤退受困竹山警分局15時45分接獲報案施工人員受困國道三號242.5公里下方溪床立即調派社寮所長林穎警員林育成前往並通報119派員救援通知集集攔河堰暫停放水以利救援,郵差遭比特犬狂咬過程全錄 飼主找到開罰萬元2019-05-18 17:09 聯合報 記者 聯合報 記者 陳斯穎 即時報導新竹縣湖口鄉上周發生郵差遭比特犬攻擊事件比特犬緊咬郵差褲管郵差最後將褲管撕裂狗鬆口掙脫過程中郵差膝蓋手腕右腳受傷事發新竹縣家畜疾病防治所經調查找到比特犬王姓飼主並依動物保護法開罰萬元罰鍰一名中華郵政姓郵差上周五行經新竹縣湖口鄉信勢國小旁一處路口停紅燈時旁邊貨車比特犬突然跳下車朝郵差腿部狂咬死咬不放長達近分鐘之久造成男腿部多處咬傷最後還扯破褲管脫困郵差遭比特犬狂咬過程被後方一輛機車行車記錄器拍下影片網友PO臉書社團湖口引發網友熱議網友留言表示狗應牢牢綁狗主人真的需要好好檢討家畜所所長彭正宇表示這名飼主說比特犬朋友託寄養驚訝比特犬竟然跳下車攻擊騎車執行投遞勤務郵差避免發生類似情形會快將兇猛比特犬還給朋友王姓飼主已經郵差達成和解,0
名嘴許聖梅18日晚間突然臉書直播中崩潰痛哭透露昨天接到一通電話通知下禮拜不用節目挺韓國瑜沒舔郭台銘腳趾頭沒工作…證實挺韓而遭電視台封殺許聖梅害怕地說自知開直播可能會台灣首富假扣押會告死真的忍耐很久不解沒有批評韓國瑜養家一個地方媽媽沒有工作活下去沒稱讚郭台銘更直言不解會挺韓國瑜沒工作許聖梅哭說想告訴一個幫老公還債想婆婆家人過好生活自爆昨天某電視台通知不用再來傷心無法入睡錯沒舔郭台銘腳趾頭沒做錯事許聖梅哭一把鼻涕一把淚模樣粉絲們相當捨紛紛留言打氣韓鐵粉工作機會給聖梅介紹韓鐵粉力量幫幫聖梅不要哭努力做一定會有機會失意一時聖梅要堅強中時電子報,本土劇女星李燕今18日證實交往一年趙駿亞分手稍早李燕被問此事僅說個性不合補充說硬要問到底不合太傷令外界好奇李燕先前談擇偶條件強調未來想要風花雪月平淡相守就夠似乎端倪37歲李燕歲趙駿亞一年前承認交往李燕過彰化縣議長謝典霖18月短命婚姻起初談離婚主因兩人口徑一致說生活時爭吵李燕稱個性差太多必須說這份婚姻幸福和諧沒有女人會放棄今年初受訪哽咽分享分手內幕原因直指四字不快樂李燕表示婚姻中適應不良價值觀落差我覺留在不快樂謝典霖不快樂當時趙駿亞交往中表示未來沒特別期待小孩想要了解相伴一定風花雪月生活穩穩當當一個陪伴趙駿亞今年初問到是否可能結婚搖頭表示不會當時外界倆口感情穩定有共識如今看來似乎暗示出問題中時電子報,0
馮提莫王姓乾爹取自央視據央視報導大陸一名擔任會計已婚王姓男子月收僅千多人民幣約萬千台幣網友出手闊錯大乾爹原來王男為討女主播歡心不惜挪用公司約930萬人民幣約4368萬台幣公款打賞每周背著妻子女主播幽會最後事跡敗露更網友發現原來王男打賞女主播包含大陸第一網紅馮提莫馮提莫繼瞞婚陪睡乾爹負面傳聞再次掀起一波爭議其實早去年月馮提莫曾針這名王姓乾爹盜用公款事情澄清坦承一次線下主播聚會見過很多總覺女主播隨便來個土豪勾搭一下走其實沒想亂馮提莫表示雖是女主播一年工資收入蠻高家境不差光靠錢勾搭覺得可能可能更直言想發一個正式聲明看有沒有辦法將這位乾爹刷禮物依法退還回去粉絲別擔心身正影子歪其實小錢博得馮提莫歡心恐怕真的容易據傳去年光靠直播收入年收高達1.6億台幣中時電子報,大陸第一網紅之稱大陸26歲網路紅人馮提莫清新外型歌喉擁千萬粉絲關注還曾土豪一次豪撒百萬打賞馮提莫成話題人物馮提莫近日身陷桃色風波日前爆床戰乾爹影片近日網路則瘋傳床照馮提莫人紅是非日前爆隱瞞已婚身分傳出接受乾爹包養爆床戰乾爹13分鐘影片沒想到網路近日瘋傳馮提莫疑似自拍床照只見馮提莫露出甜笑更網友指出馮提莫相擁男生知名土豪他還曾多次出現馮提莫聊天室中負面傳聞馮提莫沒微博發文正面回應日前高唱最美太陽藉歌曲訴心聲馮提莫透過律師發表聲明強調沒結過婚沒陪睡床戰影片更網友認為馮提莫不是影片主角近日爆出床照馮提莫說風波一波波未平一波又起中時電子報,2
昆凌爆乳出席坎城紅毯圖翻攝自昆凌IG周杰倫陪昆凌搭直升機圖翻攝自周杰倫IG72屆坎城影展台灣時間15日凌晨揭開序幕天王嫂昆凌受邀出席一向寵妻周杰倫陪愛妻搭直升機到現場更低調人群中偷偷望著老婆眼睛裡充滿愛意網友笑翻認不出周杰倫陪昆凌去完巴黎時裝周轉戰坎城影展夫妻倆沒合體走紅毯舊灑滿滿狗糧一早陪愛妻搭直升機到現場更默默混在人群中直接用行動支持低調帶墨鏡還用手遮住半邊臉避免搶走老婆風采眼神中滿滿愛意似乎對愛妻表現非常滿意網友看到周杰倫寵妻笑翻虧認不出傻孩子太可愛了真是寵妻走昆凌穿黑色平口禮服露出酥胸事業線高貴不失典雅豔壓全場粉絲狂讚美炸赫本感覺周杰倫讚愛妻美稱外面走紅毯中時電子報,電影灼人秘密今天11日釋出首波前導預告吳可熙瘋魔狀態瀕臨崩潰夏于喬跪地學狗叫散發詭譎邪氣宋芸樺則面容憔悴有別以往甜美形象位女主角演技爆發糾纏間的關係隱隱透出端倪預告拋出許多線索觀眾留下不少想像空間該片台灣緬甸馬西亞三方合製導演趙德胤首部台灣拍攝劇情長片並由趙德胤吳可熙共同編劇吳可熙宋芸樺夏于喬等主演故事描述吳可熙飾演妮娜鄉老家台北追尋電影夢事業始終沒有起色一次試鏡陷入恐怖驚悚情緒探討女性自主覺醒本片獲72屆坎城影展一種注目競賽單元入圍並在坎城進行世界首映導演趙德胤三位女星吳可熙夏于喬宋芸樺都將出席電影預計2019年上映目前海外確定美國好萊塢歐洲知名片商做北美歐亞代理CAA代理北美發行法國優質發行商LUXBOX代理全球發行灼人秘密國際版海報好萊塢海報設計師Erik Buckham操刀血紅背景營造出女性復仇懸疑感岸上影像提供旺報 ,0
NASA發布外太空超巨大水母照片原來形狀猶如水母ESO 137-001星系圖擷NASA Goddard推特即時新聞綜合報導水母地球存在大約億年之久美國國家航空暨太空總署NASA近來發布外太空超巨大水母照片原來ESO 137-001星系其形狀猶如水母漂浮一望無際宇宙之中紐約郵報報導NASA表示ESO 137-001尾部拖曳著長達26萬光年高溫氣體加上年輕恆星藍色絲帶掛在棒旋星系看起彷彿水母觸手NASA指出X射線觀察ESO 137-001星系將會發現下方一股巨大高熱氣流預計2021年發射詹姆斯·韋伯太空望遠鏡James Webb Space Telescope研究這種氣體形成原因ESO 137-001星系尾部拖曳著長達26萬光年高溫氣體圖擷NASA Goddard推特還想更新聞現在ＡＰＰ看新聞還能抽獎,以色列無人登月探測器創世紀Beresheet月球表面墜毀圖為控制室外觀眾看著創世紀拍到月球照片法新社即時新聞綜合報導以色列無人登月探測器創世紀Beresheet世界首次私人機構主導登月計畫因主引擎失效月球表面墜毀BBC報導目前前蘇聯美國中國政府太空機構達成登陸月球紀錄以色列創世紀號發射升空星期月球上空15公里處靠近最後一個軌道正準備落地引擎突然熄火以色列航太工業IAI太空部主管多倫Opher Doron控制室外觀眾報告此事現場充滿嘆息聲沒過多久引擎恢復運作觀眾歡聲雷動緊接控制室創世紀通訊中斷任務隨即宣告失敗創世紀以色列非營利組織SpaceILIAI共同推動登月項目任務目的拍照並進行實驗總耗資約億美元約新台幣30.8億元能夠成功可為將來低成本月球探測開創先例還想更新聞現在ＡＰＰ看新聞還能抽獎,0
韓國瑜就任前揚言找阿諾代言高雄觀光如今成為泡影各界砲轟左圖資料右圖美聯社資料即時新聞綜合報導高雄市長韓國瑜政見支票跳票繼香港歌手鄧紫棋沒有當高雄代言人美國好萊塢影星阿諾史瓦辛格確定月不會高雄演講批踢踢實業坊PTT鄉民蒐集過去韓市府聲稱阿諾要相關報導整理成搞笑回顧貼出張媒體剪報聯合晚報2018年12月22日刊登韓國瑜邀阿諾明年訪高雄新聞中國時報2018年12月23日全版報導魔鬼終結者阿諾明年月訪高雄蘋果日報2018年12月23日全版報導韓國瑜邀阿諾訪港消息批踢踢鄉民認當時韓國瑜說口沫橫飛如今事情逐漸跳票鄉民提到證明智障有台灣媒體慘到沒什麼駐外單位好好查一下情況韓粉出征笑往生好像肥宅單戀一個正妹處宣傳越打民調越高韓總書記厲害觀看原文請點擊下面PTT原文傳送門,潘恆旭左四今天穿起白西裝走秀記者葛祐豪攝記者葛祐豪高雄報導高雄市觀光局長潘恆旭去年底透露魔鬼終結者阿諾史瓦辛格將於今年月高雄演講下文媒體今天詢問阿諾高雄潘恆答說透過公關公司追一下進度去年12月22日當時尚未就任高雄市準觀光局長潘恆旭媒體透露說主演魔鬼終結者走紅好萊塢影星阿諾史瓦辛格將於今年月高雄演講阿諾原則同意相關細節將進一步洽談眼見已經月中阿諾來訪消息只聞樓梯響網友一直問說阿諾到底高雄 對此潘恆旭今早參加高雄10處婚攝美拍景點的宣傳記者會記者詢問此問題他答說基本上透過公關公司追一下進度阿諾沒很多明星會來媒體詢問說阿諾不會來潘恆旭則回說邀請,2
櫃買中心13日表示新鉅科股票3630月14日起預收款券並五分鐘撮合一次新鉅科股票最近10營業日營業日經櫃買中心公布注意交易資訊月14日起10營業日月27日止改人工管制撮合終端機執行撮合作業約五分鐘撮合一次各證券商投資人每日委託買賣價證券數量單筆達10交易單位筆累積達30交易單位時應當日已委託買賣投資人收取之買進價金賣出證券信用交易部分收足融資自備款融券保證金工商 ,證交所表示尚志3579因有重大訊息公布公告公司上市普通股月10日起暫停交易公司將於前開重大訊息公布申請恢復交易時機相當巧合月10日華映下市月13日前最後一個交易日尚志暫停交易頗引起市場諸多揣測工商 ,0
美國聯邦通信委員會FCC主席吉特‧帕伊Ajit Pai先前表明反對大陸電信業者中國移動China Mobile提供美國電信服務月日正式以國家安全投票否決中國移動美外國之間的電信服務中國移動營運勢必面危機中國移動今年首季4G用戶淨增1067萬戶4G手機流量去年同期增加162%寬頻用戶增加1034萬戶淨利潤下滑8.3%公司史上首見陸媒報導中國移動面臨轉型關鍵期利潤不再高速成長出現虧損情況主因大陸通訊市場競爭激烈業者價格戰中國移動華為阿里巴巴公司高度重視公司策略明顯市場脫節導致業者競爭時陷入人才嚴重流失窘境美國市場拒門外加上利潤下降市場脫節人才流失危機之外中國大陸將今年年底全面實施攜號轉網服務中國移動更將無法應付問題報導提到留給中國移動時間真的不多轉型中國移動面最大問題中時電子報,"鈺太科技公司6679將於今日以每股70元價格上櫃掛牌櫃買中心今日舉辦上櫃掛牌典禮時進行新股上櫃敲鑼儀式邀請鈺太科技公司暨輔導上櫃證券承銷商凱基證券簽證會計師會共襄盛舉鈺太科技公司主要從事數位及類微機電麥克風電源管理晶片之研發及銷售106年之合併營業收入億,634萬元稅後盈餘為,289萬元每股盈餘為1.01元107年之合併營業收入11億317萬元稅後盈餘為億918萬元每股盈餘為2.93元工商 ",0
70歲高齡護理師 耕耘45年樂2019-05-13 00:32 聯合報 記者 聯合報 記者 蔡容喬 即時報導70歲高齡護理師吳金梅資歷超過45年擔任醫院督導帶領學生實習訓練護校當過老師成為醫師娘更丈夫診所協助打理教導新進護理人員護理知識臨床實務操作輩護理師看到會尊稱一聲吳老師面對近年醫病關係轉變吳金梅表示溫柔待人會你好一直覺得事護理工作快樂事情鼓勵新進護理師紮紮實實作好臨床訓練用心照顧病人一定會感受吳金梅日前接受高市護理師護師公會表揚基層護理工作堅守崗位45年迄今還沒退休目前家耳鼻喉科及神經科診協助新進人員訓練育有名子女驕傲表示護理工作臨床要求盡善盡美子女影響全是醫學系畢業名兒子神經科及耳鼻喉科開業醫師大女兒則眼科診所服務還曾獲選港小姐名小女兒是神經科醫師醉心音樂鼓勵參加長笛比賽獲冠軍,逛夜市能繳燃料費 高屏第一處星光服務站開張2019-05-13 15:00 聯合報 記者 聯合報 記者 徐白櫻 即時報導高雄區監理旗山監理站服務走入人群本月起開辦高屏兩地第一處星光巡迴服務站監理站人員前往美濃夜市提供機車燃料費補單繳納機車報廢多項服務便利假日返鄉白天務農農民朋友旗山監理站長楊財惠表示每月固定辦理一次夜間業務監理服務更接地氣各地監理站推動行動服務業務監理站人員至各地舉辦假日考照高齡駕駛檢測服務項目旗山監理站本月推出星光服務周五晚上前往美濃夜市擺攤宣導提供項業務服務旗山監理站指出星光服務晚上點受理點服務項目包含汽機車燃料費補單機車燃料費繳納高齡駕駛人認知功能測驗機車報廢通信地址住居所申請道路交通安全推廣及各項監理業務諮詢美濃夜市腹地寬廣鄰近貫穿杉林美濃兩地月光山隧道監理站首度進駐夜市設站服務不少逛夜市人潮順道服務站洽詢相關業務不少居民當場申請電子帳單汽機車燃料費提早繳納抽獎宣導效果頗佳一晚累積近百件申請案件,0
疑車速過快 花蓮自小客車衝進民宅騎樓2019-05-13 11:53 聯合報 記者 聯合報 記者 王思慧 即時報導今日上午花蓮市和平路林政街口一部白色自小客車疑似車速過快衝撞進民宅騎樓警方獲報前往現場處理幸無任何人員受傷駕駛人經酒精測試酒測值零肇事原因目前警方釐清中,影不顧腳底刺傷 勇警跳米排水溝搶救酒醉婦2019-05-13 11:23 聯合報 記者 聯合報 記者 戴永華 即時報導宜蘭廣興派出所昨晚接獲民眾報案位冬山鄉廣興路218巷旁排水溝有名婦女跌落公尺深水溝所長林得勝立即帶著名員警前往排水溝與平面道路落差公尺員警奮顧身跳下去救人胡博盛腳底異物刺傷鮮血直流他顧受傷先救出婦人送醫包紮羅東分局長徐俊生得知前往廣興探視慰勉胡博盛消息傳出網友不禁讚勇警無懼羅東警分局表示連日來宜蘭下雨接獲報案擔心排水溝若水位高恐造成溺斃所長帶著員警鮑柏堅胡博盛趕往查看暗夜搜索發現吳姓女子趴臥水溝員警立即脫鞋赤腳下水搶救吳女滿身酒氣幾乎奄奄一息哀嚎其右側手腳痛疼警方避免吳女溺水先扶坐通知消防隊人員到場以長背板固定身體合力將吳女抬下游約50公尺樓梯處救護車緊急送往博愛醫院救治婦人邊哭邊說小心跌落排水溝,0
"臻鼎-KY4958月營收72.37億元月微幅下滑1.07去年同期成長23.17單月營收創下歷年同期新高第一季財報顯示營業收入合計194.13億元稅前淨利9.66億元基本每股盈餘0.48元臻鼎日前公告海外第二次無擔保轉換公司債轉換普通股之緣108年度股東常會停止過戶日月23日止在外流通普通股股份數增加97,481,528股普通股股份總數新增902,229,887股現金股利每股新台幣元調整為每股新台幣4.459774元工商 ",股匯同步開高走低上演雙殺戲碼新台幣終場收30.958元兌美元創近六個半月新低貶值0.2分連續三個交易日收跌台北外匯經紀公司成交量8.73億美元新台幣同步收周線累計一周貶值5.1分0.16外匯交易員表示中美貿易談判遇逆風市場美國延後加稅期待落空台股上午開高午後下殺收盤連三黑新台幣原先台股主要亞幣上揚帶動走升但尾盤再度豬羊變色並貶逾半年新低外匯交易員指出外資匯出力道減弱出口商續進場拋匯激勵新台幣反彈走揚確定加稅如期上路股匯市立即反應殺新台幣升幅趨收斂尾盤升轉貶周線同步收跌工商 ,0
