label,question,syn_question
"受制原油原物料波動干擾炎洲4306近年AABOPP上游石化原料營運受阻首季毛利率9.67本業虧損1642萬元加計業外收益稅前盈餘1.14億元稅後盈餘0.81億元年減80.88EPS0.17元炎洲轉投資新洲全球3171通路佈局調整漸收成效首季毛利率25.44營業淨利0.3億元稅前盈餘3027萬元稅後盈餘0.25億元年增183EPS 0.42元組織重整活化資產炎洲啟動分割出售旗下大陸子公司策略炎洲公告分割寧波炎洲膠黏製品有限公司寧波炎洲予100持股之新設公司藉此調整寧波炎洲財務結構及營運狀況得以改善炎洲子公司ASIA PLASTICSBVICO,LTD出售子公司寧波炎洲分割新設立公司予寧波神道貿易有限公司分割生產及銷售BOPP薄膜製品業務預估處分利益人民幣2112.3萬元工商 ",智慧家庭居家安全需求帶動數位電子貓眼智能鎖監控感測器產品銷售唱旺縮時攝影跨入相關領域邑錡7402自有品牌代工亮麗成績第一季稅後純益突破800萬元去年同期大增5.7倍EPS0.36元國內數位相機廠商不少全球相機代工龍頭地位更輪流普立爾華晶科佳能擔任真正經營自有品牌實不多邑錡打響自有品牌Brinno名號主要避開消費性市場主打縮時攝影特殊應用伴智慧家庭興起縮時攝影技術應用居家安全之上陸續開發出數位電子貓眼智能鎖監控感測器產品縮時攝影相當適合應用在建築工地邑錡會積極開發相關多元應用帶動未來營運保持良好成長動能,0
沈姓少年前晚黃姓少年追討萬5000元債務黃姓少年竟方騙新北市中和區住家樓頂趁機持開山刀追砍造成沈頭部左手多處刀傷送醫後無礙警方循線逮捕黃姓少年不願說明到底何種債務警訊依殺未遂罪嫌將他護送少年法庭警方調查沈姓黃姓少年熟識兩人萬5000元債務糾紛沈姓少年前晚永和樂華夜市巧遇黃姓少年沈向黃討債黃佯稱朋友借錢先騎機車載沈到住家樓頂沈不疑上車被載至黃位中和區安平路住家黃將沈帶頂樓等待隨後下樓換裝約小時黃頭戴安全帽口罩再度出現沈低頭滑手機砍傷沈頭部左手期間沈不斷雙手抵擋黃犯案逃逸造成沈頭部撕裂傷公分左枕骨部撕裂傷公分左肩左手多處撕裂傷沈隨後獨自下樓搭計程車就醫沈姓少年鮮血直流路旁攔計程車時名員警巡邏發現上前盤查立即通報救護車將送醫警方頂樓發現犯案開山刀循線前往黃住處家中找到犯案安全帽口罩證物黃姓少年一度否認犯案並辯稱不知情警方進一步追問坦承動手兩人何種債務不願意吐實全案刻警方擴大偵辦,基隆市仁愛區劉銘傳路日晚間時許發生撞死人事件陳男為首劉男南靈宮廣場前進行毒品債務談判一言不合陳男駕車撞死劉男逃逸當夜陳男名同夥到案警方終於11日下午時許逮捕陳男主嫌犯落網基隆市警察局提供警方調查陳男22歲撞死劉男42歲名友人黃男吳女何女棄車逃逸黃吳何因害怕當夜11時許延平派出所前查看警方查獲帶到內訊問而主嫌陳男則逃逸在外嫌犯照片基隆市警察局提供據悉陳男案發當晚逃到中山區烏頭橋西定路一帶逃到新北市汐止區今日下午回到中山區友人住處怎料竟警方逐層搜索逮個正著陳男到案警方坦承有衝撞劉男經訊警方排除將陳男依殺罪嫌移送基隆地檢署偵辦中時 ,0
韓國瑜民進黨執政不起 希望好日子2019-05-17 21:33 聯合報 記者 聯合報 記者 徐白櫻 即時報導近日高雄市長韓國瑜動作頻頻中天電視台新聞深喉嚨今晚播放韓國瑜專訪內容韓國瑜參選態勢日漸明確兩岸問題韓國瑜表示九二共識 反對台獨定海羅盤同樣中華民族共識戰爭不樂見民進黨文化斷根會下一代變成沒根浮萍韓國瑜表示年前投票給蔡英文三種第一種是討厭國民黨第二種是希望台灣獨立第三種是希望好日子韓說民進黨不起第三種人因為現人民日子越過越苦千年萬年人民要求四個字安居樂業,"韓國瑜同意納入國民黨初選民調這是天下蒼生2019-05-17 17:36 聯合報 記者 聯合報 記者 楊濡嘉 即時報導高雄市長韓國瑜今天接受中天電視台新聞深喉嚨主持人王正專訪談到國民黨總統初選時韓國瑜表示國民黨中央人小組徵詢納入初選民調他會說Yes, I do",1
橫山分局員警宿舍破舊縣議員張良印希望儘速重建羅浚濱翻攝列為新竹縣定古蹟關西分駐期所長宿舍完工未外開放縣議員羅仕琦13日質詢指有外地遊客翻牆進入造成破壞縣議員張良印對橫山分局長宿舍荒廢和員警宿舍破舊要求儘速改建讓員警良好居住環境文化局長李猶龍答覆羅仕琦質詢說關西分駐所分期修繕期所長宿舍完工期工程進行中期規劃中目前所長宿舍活化工程還在執行同時將有易接手關西鎮公所討論管理事宜預計月底正式對外開放張良印議員以荒廢橫山分局長宿舍破舊有員警住宿舍照片指橫山分局人力不足基層員警工作時間長需要乾淨休息空間環境還能住縣警局長黃家琦說荒廢橫山分局長宿舍日據時代興建是不是屬文化資產歷史建築相關單位進一步勘察確認不具保存價值將連同員警宿舍考慮重建黃家琦並指目前照門派出所新埔分局長宿舍文化單位列歷史建築加上新埔分局海砂屋勢必要重建將會併中央爭取經費中時 ,失聯越南移工躲垃圾堆被警揪出蔡依珍翻攝越南籍陳姓移工通報失聯還因酒駕通緝見警神隱11日晚間眼尖桃園警分局埔子所員警發現拔腿狂奔一度躲進死巷裡的垃圾堆識破遭警逮捕警詢解送歸案桃園警分局埔子派出所長林延安警員李靖姜之維11日晚間近點巡邏經過正光路時發現有名外籍男子見警察拔腿就跑立即尾隨攔查並呼叫巡邏網支援男子躲避員警拼命奔跑慌不擇路跑附近餐廳後方巷子見無路逃躲餐廳垃圾桶旁規避查緝遭眼尖員警發現男子見警方靠近連忙垃圾堆裡跳開再度逃跑反遭員警團團包圍制伏逮捕經查男子29歲越南籍陳姓移工通報失聯還因酒駕案件遭台中地檢署發布通緝中警詢完畢將其解送台中地檢署歸案中時 ,0
地球開發地方越來越很多動物生存空間逐漸減少動物生存只能想辦法找地方繁衍下一代這位網友一個禮拜沒騎機車發現令人驚喜畫面這位網友臉書爆廢公社分享有事將機車停放路邊想不到約莫一週時間沒有騎車機車置物箱出現不速之客原來裡面塞滿細細小樹枝樹葉碎屑樹枝密密麻麻纏繞成碗狀最中間則放著顆圓圓鳥蛋只不過短短一週原PO車廂鳥媽媽做成一個專屬鳥巢機車置物箱變鳥巢圖片取自爆廢公社原PO無奈表示一個多禮拜沒騎車鳥媽媽霸佔超級傻眼目睹鳥媽媽回巢孵蛋畫面原PO說鳥媽媽還很淡定一眼似乎說車子一下可能停陰影處置物箱大小適合築巢會吸引鳥媽媽前來孵蛋照片曝光吸引網友注意紛紛鳥媽媽求情牠多禮拜恭喜爸爸好好幫牠做月子辛苦一點搭公車走路半個月不要動車翅膀長會飛走順便顧車感謝牠好人做到底幫忙蓋遮雨棚希望鳥媽媽孵完蛋離開,難想像小小隻螞蟻造成傷害這種流傳非洲食人蟻光聽名字覺得特別兇猛不畏懼體型牠還大生物連獅子可能咬成一堆白骨非洲說一群食人蟻尤其冒險電影出現過食人蟻好奇害怕真的友食人蟻存在牠真的兇猛電影小說大部分提到食人蟻一種稱做行軍蟻稱軍團蟻牠會聚在一起組成侵略隊伍然後會陸地上行走攻擊獵物牠螞蟻不同牠不建永久巢穴蟻群幾乎不停移動行軍蟻數量一多攻擊生物圖片取自達志影像食人蟻不會電影描述可怕牠吃獅子老虎人類吃會吃造就食人蟻雜食性生存力強的特點東西入侵牠行進路線活物會群起圍攻啃食殆盡會變成非常兇狠螞蟻食人蟻顎部鋒利有助撕咬獵物說曾經有人一頭野牛屍體旁發現一群黑色螞蟻好奇蹲下更螞蟻四面八方趕過分食野牛屍體大約10幾分黑色蟻群散剩下一堆白骨,0
被譽怪物新秀小葛瑞洛Vladimir Guerrero Jr.首轟終出爐14場比賽終開轟刷新隊史最年輕開轟球員之外還趕進度般單場雙響炮名人堂老爸第一時間轉發首轟影片兒子慶祝小葛瑞洛年僅20歲今年大聯盟頭號新秀月底全球球迷關注下升大聯盟屢屢上演美技守備沒展現小聯盟火燙手感13場比賽僅有成91打擊率15日藍鳥對戰巨人比賽面對巨人投手文生Nick Vincent首打席敲發陽春炮20歲59天年紀刷新藍鳥隊史最年輕開轟球員局再轟分炮大聯盟史年輕達成生涯首轟次轟同場出爐選手一位達成2012年馬恰多Manny Machado20歲35天達成小葛瑞洛甩開打擊低潮首打席開轟之外局再擊出一發分炮幫助藍鳥將領先擴大至小葛瑞洛打數安打包含分全壘並獲次保送包辦全隊分打點成為球隊戰勝巨人功臣賽後打擊率上升成35中時電子報,資深藝人黃安長年定居大陸生活演藝重心放在日前因為母親節特地返台家人團圓13日透露一天連看前列腺心臟隔天殯儀館送親友生老病死二日遊黃安2016年心肌梗塞搭醫療專機返台進行心臟繞道手術透露媽媽擔心幾天幾夜自責不孝更注重健康回台預約醫院看診上午前列腺下午看心臟明早殯儀館送親友出殯形容生老病死二日遊有感發說年輕時忙泡妞老前列腺肥大年輕時玩心跳老心臟病年紀大什麼病收到白帖子比紅帖子多得多這是自然規律長多帥富有多樂觀無關中時電子報,0
苑裡警方迷路劉姓少年帶回所內休息巫靜婷翻攝台中市21歲劉姓少年日清晨時許精神恍惚牽著自行車徘迴苗栗苑裡鎮世界路新興路口巡邏員警行經該處時發現行為怪異立即上前關切得知少年遠石岡區騎到苑裡人生地不熟迷路警方先將帶回苑裡分駐休息劉父接獲通知表示兒子患有身心障礙感謝警方及時協助通霄分局苑裡分駐所長劉凱萍表示迷路劉姓少年家住台中石岡區星期四清晨點35分巡邏員警發現獨自徘迴苑裡世界路新興路口其面露無助神情員警上前關心交談時察覺疑似精神異常查看證件確認領有身心障礙手冊擔心浪頭街頭安全疑慮邀請一同回所內休息劉姓少年警方表示清晨家中騎自行車外出知道會騎一時找不到回家路會站路旁觀望警方表示石岡到苑裡路程約50公里遠少年獨自出門失蹤家人相當擔心劉父中午左右趕抵內將少年安全帶回警方呼籲家中身心障礙成員應注意居家作息行踨冾縣市政府社福機構申請配戴愛心手鍊身上放置寫家中地址聯絡電話字卡外出迷途時發現順利找到家人安全返家中時 ,台中市政府警察局第六分局何安派出所警友站強化照顧員警執勤安全讓員警夜晚執勤時皆安全上崗平安返所主動購買爆閃肩燈提供執勤員警使用提高辨識度降低意外發生率讓員警執勤更安心何安派出所警友站長曾騰明表示盼藉由勤務裝備升級員警執勤更加安全有效率守護社會治安穩定交通安全工作馬路虎口員警在外執勤處理事故時有意外發生第一線員警執勤安全避免意外危險發生增加辨識度提升安全保障何安警友站購買80組爆閃肩燈供執勤員警使用員警夜晚視線不良地方佩戴紅藍相間爆閃肩燈閃亮燈光路民眾清楚發現執勤員警位置讓員警在外執勤更安全便利更安心中時 ,0
高雄市長韓國瑜林宏聰攝高雄市長韓國瑜近來頻圍剿高雄巿議員康裕成日前巿議會總質詢數度橋科問答質詢巿長韓國瑜更批韓國瑜只會小抄外一問三不知韓國瑜今日高雄市議會準備一個超大平板綠營宣戰民進黨打下韓國瑜近日市議會質詢手段層出不窮微小細節會當作放大鏡檢驗幕僚PASS遞小抄綠營議員發現馬塑造韓國瑜懂市政大老粗綠營攻勢韓國瑜今日帶一個超大平板出席議會意外成為有趣花絮韓國瑜受訪表示幕僚建議使用尺寸平板電腦即時顯示各局處提供法規計畫人事組織資訊答詢議員問題時會更快速翔實認為意見事實縣市議會採用類似方式輔助答詢中時電子報,2020總統大選非韓投聲浪頻傳而據民調顯示7%韓粉表態國民黨推派高雄市長韓國瑜出馬競選不會投票7%約100萬人口國民黨台北市議員羅智強驚呼這對國民黨一大警訊TVBS報導做民調顯示韓國瑜不出原來投韓國瑜8%不會投票1%人會轉投郭台銘這兩者差距7%換算大約100萬人非韓不投對此羅智強資深媒體劉寶傑主持節目關鍵時刻表示100萬對國民黨非常警訊他強調現真的100萬人非韓不投明年月11日還是不是100萬看國民黨表現最終韓國瑜選沒問題韓國瑜沒有選100萬還是不是100萬時間解答羅智強強調韓國瑜現眾人圍攻韓在藍營支持力量非常穩固羅表示副粉專做民調超過三分之二支持韓國瑜選總統三分之一支持韓留在高雄之前發生事件黄捷綠議員質詢根本沒有影響韓國瑜藍營心目中地位藍營韓國瑜支持者依舊非常非常高中時電子報,1
同婚立法進入倒數階段立院攻防政院版機率五五波行政院長蘇貞昌認為同婚專法價值選擇希望能爭取通過政院版草案行政院發言人Kolas Yotaka 表示明天行政院會後將舉行行政立法協調會報再次尋求同黨立委支持政院版專法Kolas說明天行政立法協調會行政院原本希望行政院版專法立法委員溝通尋求支持巧遇執政黨團原本召開黨團會議討論此事雙方決定合併召開將採行政立法協調會形式召開由民進黨團總召柯建銘行政院副院長陳其邁共同主持中時 ,藍委下戰帖要求進行自貿區辯論行政院發言人Kolas Yotaka表示經濟政策立法院討論藍委公開邀請蔡政府財經官員經貿特區條例重大國家政策進行辯論希望真理越辯越明行政院回應似乎沒有接下戰帖Kolas認為經濟政策立院討論即可行政院各部會首長依憲法立法院負責部長立法院報告並接受立委質詢國會中清楚說明經濟政策中時 ,0
"Q1製造業產值年減4.95% 沈榮津擴大內需補足2019-05-17 17:49 聯合報 記者 聯合報 記者 張語羚 即時報導經濟部統計處今天發布108年季製造業產值兆,578億元年減4.95%終結連季正成長經濟部長沈榮津今天說美中貿易戰全球經濟稍微下滑時刻一定擴大內需希望藉由台商回流動能補足下滑部分沈榮津今天出席頒發瑞典台商會畢露意絲執行長經濟專業獎章前受訪表示美中貿易戰延燒造成全球經濟微幅下滑站政府角度階段需要擴大內需目前推動前瞻基礎建設＋產業創新綠能建設沈榮津說產創條例投資抵減已經送入立法院預估會期會未來產業界享受租稅投資抵減希望帶動投資風潮台商回流行動方案推動已有近千億投資金額返台會帶動國內動能希望能夠彌補下滑一塊",波斯灣情勢緊張下周汽油公升喊漲0.3元2019-05-17 12:38 聯合報 記者 聯合報 記者 張語羚 即時報導波灣情勢緊張國際油價上揚 圖Ingimage 分享 facebook波斯灣地區情勢緊張國際油價應聲喊漲預估下周我國汽柴油公升恐漲0.30.4元95鉛汽油公升將漲30.4元累算月16日7D3B周均價為71.52美元上周70.02上漲1.50美元新台幣兌美元匯率31.121上周30.934貶值0.187元依浮動油價調整機制作業原則考慮亞鄰平穩措施預估下周汽柴油零售價格公升約調漲0.40.5元不過當95鉛汽油公升突破30元門檻時中油將會啟動平穩機制預估下周汽柴油公升漲幅0.30.4元估92鉛汽油公升28.9元95鉛汽油公升30.4元98鉛汽油公升32.4元超級柴油公升27元實際價格中油公布為準,0
日前歐陽娜娜發表中國人言論引發兩岸網友隔空交火沒想到Instagram貼文提及『阿六仔』滿到炸開地方驚見許瑋甯讚此舉引發大陸網友不滿揚言封殺對此微博澄清道歉表示將關掉Instagram嚴格反省許瑋甯微博PO文認錯表示犯奇蠢錯誤平時Instagram習慣看圖太仔細文字依舊看圖習慣點讚看清內容簡直想抽大嘴巴平時討厭言論愚蠢行為大眾致歉表示祖籍中國安徽蕪湖現在家人搬南京年回去尋根珍惜有家感覺海峽兩岸一家人走有家屬感認為身為混血自然比別更需要身份認同屬感許瑋甯微博全文圖許瑋甯微博表示未來會更加謹言慎行未來將關掉Instagram帳號嚴格反省並且將督促嚴格反省再次朋友致歉大陸網友似乎不太領情怒斥許瑋甯賺人民幣之餘還罵大陸人根本就是雙面粉絲緩頰認為許瑋甯真誠道歉難道不能放過中時電子報,桃花開許瑋甯認愛攝影界蔣友柏許瑋甯日前拍攝電影剛殺青IG發文摩洛哥見…看似出遊北非爆是閃嫁攝影師男友劉又年蜜月之旅回顧之前苦戀阮經天年沒主要男方交往期間多次偷吃加上還把她當工具導致兩人分手阮經天2014年傳出許瑋甯求婚成功雙方沒承認受訪時表示婚會結不要太急畢竟結婚雙方家庭不能太隨意過後來大陸發展花邊新聞頻傳加上許瑋甯交往年期間傳出偷吃前女友大陸已婚H女星韓星尹恩惠加上前女友大爆性事埋下兩人分手導火線更爆料指出阮經天交往期間外地拍戲時許瑋甯當成工具頻頻送東送西一度傳出兩人復合中途殺出王柏傑導致阮經天雖積極挽回許瑋甯徒勞無功中時電子報,0
"貿易戰恐衝擊蘋果獲利 蘋概三王齊跌市值掉1398億2019-05-13 09:59 經濟日報 記者 經濟日報 記者 楊伶雯 即時報導美中貿易戰火升溫美國總統川普揚言進一步加徵關稅外資擔憂一波手機產品遭列入恐衝擊蘋果獲利台廠供應鏈也將影響台股13日開低走低蘋概三王領軍下跌公司早盤市值一口氣就掉,398.02億元川普關稅攻勢持續升溫繼,000億由中國輸美產品關稅調高到25%雙方未達成協議恐將發動下一波關稅加徵行動將對剩下,250億美元商品加稅屆時台廠科技大廠衝擊恐將擴大外資評估銾動進一步加稅蘋果恐難逃衝擊獲利恐減少成相關蘋果供應鏈密切關注整個事件發展台股蘋概股今日走跌股王大立光一度下探,265元市值掉254.79億元",台股大跌逾百點 食品族群成資金避風港2019-05-13 11:35 經濟日報 記者 經濟日報 記者 高瑜君 即時報導台股大跌百點電子族群走弱盤面焦點轉向受惠美中貿易戰生產基地轉移非美中股食品族群股卜蜂1215今日盤中漲超過4%卜蜂受惠非洲豬瘟近期法人買超帶動股價走揚今年季營收50.35億元年增1.57%黃豆玉米價格持平卜蜂今年營運可望逐季回升國泰證期顧問處協理簡伯儀指出食品族群歷年月表現強勢上漲機率成貿易戰來襲之下機會呈回資金避風港,0
櫃買中心13日表示新鉅科股票3630月14日起預收款券並五分鐘撮合一次新鉅科股票最近10營業日營業日經櫃買中心公布注意交易資訊月14日起10營業日月27日止改人工管制撮合終端機執行撮合作業約五分鐘撮合一次各證券商投資人每日委託買賣價證券數量單筆達10交易單位筆累積達30交易單位時應當日已委託買賣投資人收取之買進價金賣出證券信用交易部分收足融資自備款融券保證金工商 ,異動磁場十分強盛正向這是大利轉變現況寫照尤其職場環境變化十分值得嘗試沒有轉變計畫必要改變心境安排專業學習機會將會蛻變值得提醒家庭事務需要謹慎面本周不利搬家入宅修造購屋稍安勿燥幸運物色彩硨磲白色幸運數字組合,0
袁詠儀辣穿比基尼張智霖凸肚搶鏡圖翻攝自微博港星袁詠儀張智霖結婚18年育有一子Morton魔童一家感情幸福樂近日朋友搭船出遊袁詠儀罕見穿比基尼47歲依舊保有不科學美貌身材網友發現照片中張智霖圓潤不少意外成亮點袁詠儀難穿黑色比基尼友人大玩海泥漿全身泥巴難掩凍齡美貌身材看不出已經47歲網友直呼不科學想擁有身材12歲兒子身高更是直逼爸爸張智霖一家人站排相當搶鏡讚顏值擔當相比袁詠儀張智霖肚子發現微凸網友笑虧哥肚子智霖哥胖更搞笑說卡通人物哆A夢意外成為討論焦點中時電子報,網友po出用動漫簽大女兒家庭聯絡簿萬名網友驚呆翻攝爆廢公社二館家庭聯絡簿國小老師學童父母繫管道學童沒寫功課學校表現透過聯絡簿家長反映最近一位學童爸爸另類簽名太獨特連老師嚇到問學童是否可拍照留念更大批網友不禁佩服讚嘆...網友臉書社團爆廢公社二館分享張大女兒家庭聯絡簿照片發文說老師看到大女兒聯絡簿問大女兒妳爸爸麽麽印章大女兒只好回應爸爸用畫…老師忍不住問老師拍照從原PO分享照片原PO簽聯絡簿時畫插畫圖案從魯夫珮珮豬都還不忘畫出姓氏超強PO文引起萬多名網友熱議紛留言表示強啊佩服地表最強老爸網友說爸爸總是不會失望小孩沒辦法簽名每日一笑老師肯定每天期待爸爸簽名這叫爸爸混更釣出小時曾仿老爸簽名網友說還好爸不會畫畫我小時候活模仿爸媽簽名得以平安長中時電子報,0
影台中槍擊死傷 歹徒持槍行刑式殺2019-05-18 14:16 聯合報 記者 聯合報 記者 游振昇 即時報導台中市沙鹿區今天發生槍擊命案 兩名歹徒一長一短槍進入餐廳對著死者史姓男子行刑式方式開槍死者頭部胸部多處中槍餐廳夫妻受波及受傷台中市清水分局偵查隊長林明瑤說今天中午接獲報案沙鹿區中山路餐廳槍擊案 行刑式開槍30歲史姓男子送醫急救不治餐廳夫妻用餐受流彈波及受傷,酒駕汽車加速衝撞前方機車 摔落邊坡死重傷2019-05-18 20:10 聯合報 記者 聯合報 記者 陳斯穎 即時報導新竹縣關西鎮台三線新昀加油站附近今天下午約點羅姓汽車駕駛酒駕車機車衝撞發生車禍機車摔落邊坡共受傷名重傷機車騎士傷勢嚴重送醫前生命跡象急救宣告治新竹縣消防局接獲報案立即派遣共車10警消義消前往搶救現場傷者共名名重傷目前搶救名呼吸心跳橫山91送往竹東榮民醫院名重傷傷患者送往桃園804醫院名右大腿骨折傷患救護車送往竹東台大醫院警方調查羅姓駕駛酒後開黑色轎車載名友人行經台三線關西鎮南興里路段撞前方機車機車騎士乘客連人帶車摔落邊坡騎士傷勢嚴重送醫前生命跡象機車乘客身受重傷汽車一名乘客則右大腿骨折而羅男酒測值0.43毫克,0
"網路家庭8044公布今年第一季營運成績受惠旗下B2C業務強勁成長加上子公司商店街市集之個賣場貢獻營收網家第一季擺脫虧損重返獲利單季每股盈餘為0.42元營收達92.02億元去年同期成長12.3營運動回升網家近兩年因協助商店街大打行銷戰導致推銷費用暴增2017年第三季單季呈現虧損2018年虧損收斂難逃全年虧損命運全年稅後淨損17.67億元每股淨損8.49元網家今年第一季營運見好轉第一季推銷費用去年同期下降逾50稅後淨利,135萬元去年同期稅後淨損8.43億元虧轉盈單季每股盈餘0.42元擺脫去年每股虧損4.03元窘境網家表示第一季業績增長動能自農曆年前大型家電消費3C商品銷售強勁拉動並引進全新跨境生鮮年貨刺激消費帶動B2C第一季成長強勁行動端部分因持續優化行動購物業績保持50成長子公司商店街個人賣場則貢獻營收Pi拍錢包拓展更多元消費場景P幣使用通路數大幅提加速集團O2O發展工商 ",KPMG安侯建業會計師事務14日指出全球風險投資總額2018年第四季710億美元下跌2019第一季530億美元今年首季規模最大交易案件包括總部位紐約共享辦公空間The We Company獲50億美元投資新加坡Grab Taxi獲45億美元投資KPMG分析2019年第一季美國地區交易估值持續保持強勁達到326億美元這是過去年來第二高季度總今年首季亞洲地區投資金額大幅下滑一季169億美元降本季130億美元2017年第一季最低單季融資金額工商 ,0
