label,question,syn_question
作家苦苓本報系資料知名作家苦苓日前政論節目中驚爆猛料直指館長選前訪問韓國瑜之前黨送錢給知道沒收改口韓國瑜講高雄老窮新崛江…一席話引發網友熱議惹毛館長陳之漢昨晚直播中不滿熱心公益出錢出力還遭苦苓瞎扯收錢一度難過拭淚透露已聯絡律師準備提告風波越演越烈苦苓今早臉書PO出致歉聲明坦言電視上質疑館長是否接受統促黨給錢一事消息來源說明為純屬聽聞稍早公開現身再次向館長致歉表示若館長提告權利會尊重宅神朱學恒臉書PO文提議建議館長兩拳原諒省律師費直播造福大眾苦苓臉笑尷尬表示我想這老骨頭可能禁不起當面館長道歉館長直播中道歉非常樂意苦苓透露何會節目中質疑館長假設真的統促黨設法送錢給請幫助韓國瑜話表示說中共方面遺餘力…想要證實這件事情作法錯誤中時電子報,知名作家苦苓日前爆料館長陳之漢去年開直播專訪韓國瑜主要某黨送錢給知道沒收此館長開直播澄清更一度落下男兒淚稍早苦苓臉書突然PO文向館長道歉立刻引起網友議論苦苓稍早公開館長道歉並在臉書PO文電視上質疑館長是否接受中華統一促進黨給錢之事消息來源現說明純屬聽聞提問懷疑均對館長不禮貌信任此向館長館粉公開道歉表示將在政經不會倒網路節目中說明事情原委再次公開道歉苦苓臉書全文圖苦苓臉書文末苦苓更公開向館長喊話表示館長需要願直播節目中公開道歉展現十足誠意此館長則暫未此事做出回應中時電子報,2
中國將送高雄隻貓熊取自潘恆旭臉書記者葛祐豪高雄報導高市觀光局長潘恆旭今天證實中國將送兩隻貓熊給高雄壽山動物園市府成立貓熊小組準備迎接雄雄融融潘恆旭今早臉書貼出貓熊照片定位重慶市還寫融融雄雄受訪時證實中國重慶動物園指定致贈兩隻貓熊給高雄高市觀光局也將成立貓熊小組預計月份前往重慶考察潘恆旭說台灣省人大代表許沛上周抵台接觸表示活絡重慶高雄兩城市交流重慶動物園將要送兩隻貓熊給壽山動物園歲母貓熊融融歲公貓熊雄雄,中國西安秦嶺野生動物園隻貓熊瘦皮包骨圖擷自微博即時新聞綜合報導貓熊總是給人圓滾滾毛絨絨印象中國西安秦嶺野生動物園隻貓熊瘦骨嶙峋像是消了氣氣球精神無精打采瘦到皮包骨貓熊中國網路上引起熱議動物園方面對此解釋貓熊牙髓炎好多天沒有進食會變得瘦專家則指出牙髓炎會貓熊感到劇痛北京青年報報導西安秦嶺野生動物園負責人指出網路上流傳貓熊照片真的人為原因牠變瘦隻貓熊年齡本來牙齒差不多老化加上患有牙髓炎幾乎吃不下東西負責人強調已經請獸醫進行治療貓熊身體目前正在恢復食量恢復正常調理差不多時會將牠外展出陝西省大貓熊研究中心主任雍嚴格指出牙髓炎牙髓組織病變血管會充血滲出物聚集神經壓迫產生劇痛貓熊瘦骨嶙峋圖擷自微博,0
沈姓少年前晚黃姓少年追討萬5000元債務黃姓少年竟方騙新北市中和區住家樓頂趁機持開山刀追砍造成沈頭部左手多處刀傷送醫後無礙警方循線逮捕黃姓少年不願說明到底何種債務警訊依殺未遂罪嫌將他護送少年法庭警方調查沈姓黃姓少年熟識兩人萬5000元債務糾紛沈姓少年前晚永和樂華夜市巧遇黃姓少年沈向黃討債黃佯稱朋友借錢先騎機車載沈到住家樓頂沈不疑上車被載至黃位中和區安平路住家黃將沈帶頂樓等待隨後下樓換裝約小時黃頭戴安全帽口罩再度出現沈低頭滑手機砍傷沈頭部左手期間沈不斷雙手抵擋黃犯案逃逸造成沈頭部撕裂傷公分左枕骨部撕裂傷公分左肩左手多處撕裂傷沈隨後獨自下樓搭計程車就醫沈姓少年鮮血直流路旁攔計程車時名員警巡邏發現上前盤查立即通報救護車將送醫警方頂樓發現犯案開山刀循線前往黃住處家中找到犯案安全帽口罩證物黃姓少年一度否認犯案並辯稱不知情警方進一步追問坦承動手兩人何種債務不願意吐實全案刻警方擴大偵辦,四川省巴中市通江縣公安局10日發布通報縣諾水河鎮初中36歲張姓教師日同事發生糾紛持匕首同校45歲關姓教師刺死隨後被警方控制通報指出張男為通江縣諾水河鎮初級中學教師今年36歲為諾水鎮日20時左右同校關姓教師發生糾紛持匕首刺入對方右大腿股動脈同事送醫宣告治通江縣公安局警方強調目前已將張男控制詳細案情仍待進一步調查釐清旺報 ,0
鐵票生鏽澳洲前總理艾伯特 丟掉24年地盤2019-05-18 18:56 聯合報 記者 聯合報 記者 李京倫 即時報導澳洲國會大選初步計票顯示前總理現任眾議員艾伯特丟掉24年來新南威爾斯州華令加選區眾議員席次輸給無黨籍候選人薩莉．史特格爾開出近兩成選票顯示艾伯特第一排序票得票率37%史特格爾則45%,澳洲大選出口民調 勞工黨小勝2019-05-18 17:44 聯合報 記者 聯合報 記者 李京倫 即時報導澳洲國會大選18日投票東岸各州截止投票並開始計票Nine News報導出口民調顯示中間偏左在野勞工黨將以52%得票率贏過自由黨國家黨執政聯盟48%,0
台灣各地天氣晴朗炎熱午後溫度更是動輒探30度不少外出奔波機車族吃盡苦頭近日網友路上直擊一名坐在機車後座女乘客穿著清涼幾乎快要露到大腿根部熱褲露出大片美背U自行挖背上衣網友暴動直呼熱到衣服融化原PO日前臉書不公開社團爆廢公社PO出一張照片畫面中見情侶騎車雙載看似平常街景坐在後頭女子搶盡眾目光焦點一件直探腰際U型挖背上衣讓露出大片美背原PO瞬間傻眼照片曝光隨即掀起網友熱議紛紛留言回應熱到衣服融化風太大領口鬆美背100分可能想做日光浴做紫外線殺菌有人打趣說道衣服穿反經濟真的不好只能穿少布料衣服,許多人喜歡電影紓壓沒想過何電影院座椅幾乎紅色背原因其實隱藏科學小玄機文化部過去解答觀眾將視線聚焦前方螢幕會希望座椅隱形紅色人體低光源環境容易喪失辨色能力顏色會刻意採用紅色提升觀影品質專業網友解釋影廳採用反光最弱黑色偏好紅色原因怕途中進場觀眾找不到位置其實比較專業小影廳深灰色椅子事實人體視網膜構造分為錐狀細胞cones桿狀細胞rods紅橙黃綠藍靛紫種顏色白天時光線充足眼睛錐狀細胞來處理視覺並在亮光環境黃色敏感這也雨衣顏色多半做成黃色居多顏色則依序遞減夜晚時視覺則改由桿狀細胞處理桿狀細胞無法分辨顏色只能辨別灰階明暗程度綠色最為敏感紅色則會優先喪失辨色能力電影院座椅布幕多半選擇紅色關上燈不易影響觀影體驗,0
鵜鶘眾人驚奇中獲得選秀狀元籤NBA知名記者查拉尼亞卻立刻爆料一眉哥安東尼戴維斯依舊不想鵜鶘離隊心相當堅定鵜鶘新總裁大衛葛瑞芬手氣極佳2014年代表騎士抽到狀元籤今年剛入主鵜鶘立下大功勞原本打算抽完籤立刻前往洛杉磯安東尼戴維斯見面希望挽回這位巨星心查拉尼亞澆了一盆冷冰冰水查拉尼亞表示鵜鶘未來將會以錫安威廉森為主軸組隊更安東尼戴維斯堅定離隊心思查拉尼亞強調大衛葛瑞芬前往洛杉磯主要目的留人無法成功以大衛葛瑞芬個性肯定會果決安東尼戴維斯交易出去然後全心全力扶植錫安威廉斯成為球隊當家一哥中時電子報,AAE執行長大衛‧馬丁左韓國瑜一起受訪圖擷自直播畫面高雄市長韓國瑜昨日自爆美國漫威公司想奮鬥過程變成漫畫市府證實前漫威成員現為AAE執行長大衛‧馬丁David Martin拜會韓國瑜這起漫威烏龍事件大衛‧馬丁今天下午韓國瑜陪同出面說明大衛‧馬丁指出公司創造英雄原型韓國瑜身上看到英雄故事韓國瑜一個平凡變成城市領袖希望這事蹟變成一部漫畫做全球發行希望透過漫畫學習韓國瑜奮鬥人生態度韓國瑜烏龍事件表示大衛‧馬丁昨天突然他講嚇一跳大衛‧馬丁覺一個賣菜郎離開政壇很多年突然選上市長他覺變成漫畫韓國瑜澄清昨天採訪時把畫拿出原本並沒有公開公布脫口出漫威要出漫畫韓國瑜表示清楚公司漫威垂直整合水平整合顯然相當多業務共同蜘蛛人蝙蝠俠綠巨人浩克開心接受沒有想法中時電子報,0
證交所表示錸寶8104將於今14日15時30分證交所樓記者室執行長王鼎章說明股份變換簽訂意向書工商 ,尚志357910日重訊宣布今年第一季財報每股淨值轉為負數3.95元依規定將下市證交所表示尚志申報財報對外公告下市時間第一季財報申報期限月15日前目前內部估算若證交所月16日正式公告尚志將於月26日下市證交所表示尚志10日重訊公布股票13日恢復交易繼月日綠能下市華映也將月13日下市10日交易日以漲停0.17元作收成交量放大5.31萬張,0
本土劇女星李燕今18日證實交往一年趙駿亞分手稍早李燕被問此事僅說個性不合補充說硬要問到底不合太傷令外界好奇李燕先前談擇偶條件強調未來想要風花雪月平淡相守就夠似乎端倪37歲李燕歲趙駿亞一年前承認交往李燕過彰化縣議長謝典霖18月短命婚姻起初談離婚主因兩人口徑一致說生活時爭吵李燕稱個性差太多必須說這份婚姻幸福和諧沒有女人會放棄今年初受訪哽咽分享分手內幕原因直指四字不快樂李燕表示婚姻中適應不良價值觀落差我覺留在不快樂謝典霖不快樂當時趙駿亞交往中表示未來沒特別期待小孩想要了解相伴一定風花雪月生活穩穩當當一個陪伴趙駿亞今年初問到是否可能結婚搖頭表示不會當時外界倆口感情穩定有共識如今看來似乎暗示出問題中時電子報,去年趙駿亞出書李燕站台資料相愛容易相處難趙駿亞李燕年短命戀畫下句點分手主因個性不合剛從馬爾地夫回台趙駿亞18日坦言雙方月前和平分手交往過程認真家人互動遺憾緣份不能據知父母本來希望雙方有趙駿亞爸媽喜歡李燕這協議分手家人感到失望原本這次馬爾地夫李燕約同行最後是趙駿亞一個出國療情傷趙駿亞李燕因合作八點檔一家人來電趙駿亞去年出書踩環島西南東北李燕到場站台去年七夕情人節趙駿亞難曬出李燕甜蜜穿黑白米奇情侶裝趙駿亞電視劇新兵日記飾演王威班長寫告白掩蔽班長施放閃光彈李燕沒多久回一人讚救救班長連粉絲隔空感受甜蜜氛圍如今分手李燕照常忙拍八點檔其餘時間則經營保養品牌趙駿亞月底將為運動品牌拍攝代言廣告接下將拍攝新戲面對逝去戀情40歲感嘆總歲數認真遺憾中時 ,2
民進黨主導台灣同婚專法17日立法院正式過關南部不少民眾無法認同包括長老教會台南中會牧師机嘉勝直言教會明年總統選舉不會支持蔡英文前行政院長賴清德事後在臉書發表挺同言論出現情緒激動支持者退出挺賴社團群組台灣社會成為亞洲第一同志婚姻合法國家民風保守南台灣立刻出現反彈台南擁有83教會數萬教友長老教會台南中會不少教友出現不滿憤慨情緒是民進黨挺英派南部立委擔心影響明年選舉拒絕簽署支持長老教會台南中會牧師机嘉勝表示民進黨當初資深黨員蔡同榮林義雄推動公投如今沒公投放在眼裡違背去年底765萬張反同公投票民意長老教會尚未對外表明立場近日會開會決定作出反應直言明年不會支持蔡英文選總統賴清德臉書粉絲頁17日同婚專法過關發表挺同言論臉書社團立刻引起正反兩極民眾爭論手機聊天室支持者群組有情緒激動粉絲退出群組表達抗議諷刺同婚支持者幫賴清德選總統民進黨台南市黨部表示雖然網路上確有抗議同婚專法聲音黨部尚未接獲反同民眾抗議同婚情資中時 ,明天立法院將表決同婚相關專法蔡英文總統臉書表示現在很難人人滿意紛擾畫下句點總統指出司法院釋字748號解釋施行法草案立法院進行表決議題三年討論社會過許不同意見家庭裡世代間宗教團體內部造成裂痕現在很難人人滿意紛擾畫下句點說謝謝行政院竭盡心力歧見中找到平衡點更謝謝民進黨立法院黨團一位成員面對壓力最終採取一致態度解決問題明天關鍵時刻我要拜託民進黨立委知道身處極大壓力逆境當中繼續堅持民進黨價值說台灣一個同胞手足歧異生活同一塊土地家人希望民主過程包容差異相互體諒取代對立相愛的相守這將台灣令人感動風景中時 ,1
網路瘋傳水果減肥法許多人怕胖晚餐不吃飯吃水果水果晚餐吃真的健康減肥醫師指出長久下來可能造成營養失衡膚質變差最大致命傷在減肥結束時恐越減越肥丁香醫生網站指出水果中維生素 B1 鐵鋅元素含量低蛋白質不足水果完全主食會造成一天當中蛋白質攝入量大幅下降容易引起浮腫病特別女孩子水果當飯吃會發現頭髮掉很多皮膚鬆弛容易腫脹臉色暗淡長時間下來可能會出現月經量減少長時間不來情況這都營養不良帶來麻煩吃水果減肥萬萬不可長期持續水果減肥法最大致命傷在減肥結束時長期吃水果造成身體代謝紊亂結束減肥恢復正常飲食身體會失去蛋白質快速補回來蛋白質增加體重飛快反彈丁香醫生提醒水果糖分甜點飲料裡糖分同一回事千萬不要果糖美麗詞彙蒙騙水果吃太不運動照樣會人長出肥肉中時電子報,風靡東南亞國家水果果后山竹白色果肉甜美多汁酸甜滋味深受眾人喜愛台灣2003因果實蠅問題禁止泰國山竹輸入睽違16年農委會今天表示現在泰國完成符合標準檢疫作依國際貿易作月26日預告最快月底開放進口台灣解禁最快七月開放常溫山竹進口 饕客期待中央社報導農委會動植物防疫檢疫局植物檢疫組組長陳子偉指出台灣山竹產量很少開放進口後並不會衝擊國內產業山竹標準熱帶水果泰國提出蒸熱檢疫方式專家審查符合檢疫標準最快月底重返台灣市場對此網友紛紛PTT歡呼水 小時候最愛吃水果回來原來多年沒吃...好吃吃起來山竹超好吃酸酸甜甜戀愛的滋味差不多中時電子報,0
行政院長蘇貞昌同婚專法闖關前夕綠委軟硬兼施說同婚案是民進黨大敗更難選這種黨輸輸概念動搖不肯支持政院修正版立委立場問題明年若選輸綠營眾家立委可不蘇揆一人之下閣揆沒位子馬回家吃明年立委總統大選執政成敗此局綠委隨人顧性命導致同婚專法難一致共識黨團遲未討論是否祭出黨紀恐怕相關考量從現實面政院版同婚專法闖關確定成就一定包括小英總統附帶受益選區壓力小者愈往南走愈往偏鄉會區完全不同闖關失敗更難選倒不如說成敗不好選去年九合一不同明年中央執政權之戰鹿死手還在未定之天立委選輸恐怕打包走沒正副閣揆國營企業公股銀行董總位子坐一局真是歷史關鍵時刻問題成就小英輸鄉親選票坐滿位子不見容得下敗選綠委同樣敗選去年明年兩樣情不要隨人顧性命綠委可得好好盤算中時 ,明天立法院將表決同婚相關專法蔡英文總統臉書表示現在很難人人滿意紛擾畫下句點總統指出司法院釋字748號解釋施行法草案立法院進行表決議題三年討論社會過許不同意見家庭裡世代間宗教團體內部造成裂痕現在很難人人滿意紛擾畫下句點說謝謝行政院竭盡心力歧見中找到平衡點更謝謝民進黨立法院黨團一位成員面對壓力最終採取一致態度解決問題明天關鍵時刻我要拜託民進黨立委知道身處極大壓力逆境當中繼續堅持民進黨價值說台灣一個同胞手足歧異生活同一塊土地家人希望民主過程包容差異相互體諒取代對立相愛的相守這將台灣令人感動風景中時 ,1
前台北市副市長李永萍投入新北市12選區國民黨初選李永萍臉書上公布新六星級黨鞭助選團讚聲影片包括林德福賴世葆費鴻泰李彥秀林奕華柯志恩六位立委齊為李永萍拉抬聲勢拜託選民會做事人才回到立法院鄉親服務六位立委稱讚李永萍非常戰鬥力一位女委員藍營女力中最強戰將擔任過台北市政府文化局長副市長有點子能力認真努力執行力立委李永萍一定拚出文創經濟拚出新北觀光人才絕對回到立法院李永萍表示感謝深知做事經驗能力立院同事背書保證肩上擔子更重更矢志承擔希望選民給初選過關機會貢獻生涯能力經驗回報給侯市長立院同事鄉親支持肯定李永萍指出七星區的重要議題包括汐止交通改善捷運汐止民生線瑞芳車站鐵路高架化瑞水金九世界遺產旅遊小鎮金山警分局搬家不再遮庇慈護宮七星區文化觀光絕對信心推動中時 ,新北市第十二選區國民黨立委初選戰況激烈新北市長侯友宜今11日 為候選人李永萍獻聲支持侯友宜說李永萍擔任過台北市副市長兩屆立委做事認真經驗豐富大力推薦政壇人才未來當選新北市七星區立委定能鄉親好好服務爭取資源繁榮地方李永萍表示新北市七星區 汐山金山萬里端芳平溪双溪貢寮 觀光文創資源豐富發展潛力相當大市長侯友宜發展市政改善交通充滿企圖心未來當選立委一定全力新北市侯友宜合作串連雙北市幫助新北市七星區大發展市民賺大錢中時電子報,2
莫內乾草堆34.4億元拍出 30年增值44倍2019-05-15 11:53 聯合報 記者 聯合報 記者 胡夢瑋 即時報導法國印象派大師莫內一幅乾草堆系列作品14日紐約蘇富比Sotheby's拍賣會億1070萬美元約台幣34.4億元賣出改寫莫內作品紀錄這幅畫1986年首次拍賣會待價而沽以有史前十高金額售出成交總額包括畫作佣金1986年上次拍賣價44倍乾草堆系列共有25幅畫作莫內在家鄉吉維尼Giverny18901891年冬天完成作品裡展現對每天每季不同時間氣候光線周遭變化觀察一部畫作2016年8140萬美元賣出14日拍賣這幅最具指標性一幅系列畫作不同特色包括它色調充滿活力不同方向戲劇性斜畫筆觸畫作中心會合第一乾草堆部分顯現前景,南韓儒家書院上榜世界遺產預備清單 月底可能2019-05-14 12:43 聯合報 記者 聯合報 記者 季晶晶 即時報導南韓文化遺產廳14日表示九座儒家書院上榜世界遺產預備清單歐新社 分享 facebook韓聯社報導南韓文化遺產廳周二14日表示南韓九座儒家書院推薦增列聯合國教科文組織UNESCO世界遺產預備清單文化遺產廳這是UNESCO旗下諮詢機構國際文化紀念物歷史場所委員會ICOMOS建議最終決定UNESCO世界遺產委員會World Heritage Committee月底亞塞拜然首都巴庫召開年會時做成文化遺產廳說世界遺產委員召開年會時通常會接受ICOMOS建議儒家書院申遺成功南韓可能擁有14座世界文化遺產包括首爾市昌德宮南韓儒家書院建13921910年間首爾當局2015年首度申遺一年主動撤銷ICOMOS當時認為南韓無法證明儒家書院中國日本儒家書院顯著不同南韓後來持續進行相關努力去年月重新提出申請,0
漁民有愛海巡伸援 珍稀欖蠵龜重獲生機2019-05-12 09:59 聯合報 記者 聯合報 記者 羅紹平 即時報導漁民今天清晨東河鄉金樽漁港外海誤捕隻欖蠵龜漁民擔心放走受傷欖蠵龜恐不利牠茫茫大海中求生存主動通報海巡署東部分署13岸巡大隊獲報立即伸援手安置隻嬌客通報台東縣政政府農業畜產保育科善,種電衝擊黑琵棲地 台管處國家公園內不應設光電板2019-05-12 09:25 聯合報 記者 聯合報 記者 黃宣翰 即時報導保育人士憂心種電政策嚴重衝擊黑面琵鷺棲息台江國家公園管理處長謝偉松今天說台管處站經營管理保育國家公園立場園區黑琵棲息零損失重要目的尤其核心生態保育區及國家重要濕地範疇更應嚴格保護台管處認為台江國家公園範圍及台管理代管國家重要濕地範圍不應納入再生能源設施設置考量包含光電板風機以達保育目的台灣黑面琵鷺重要度冬區最新統計全球數量今年達到千463隻創下紀錄台南七股曾文溪口黑面琵鷺主要棲息數量停滯保育人士憂心鄰近嘉義縣布袋鹽田八區棲息因光電板黑琵也漸消失不少棲地面臨綠能種電食物源減少汙染衝擊謝偉松表示台江國家公園園區範圍以外地區涉及包括當地養殖業者權益地方政府相關事業主管機關權責認為應該審慎評估充分溝通等候達成共識再行推展,0
陳建州透露復仇計劃黑暗中撇屁全場來賓逗得哈哈大笑圖取材自神隊友 Youtube模範夫妻檔陳建州黑人范瑋琪范范結婚年育有一對雙胞胎兒子飛飛翔翔一家四口深得粉絲喜愛樂分享生活大小事陳建州近日神隊友透露帶飛翔兄弟搭飛機時疑似遭身旁乘客歧視脾氣陳建州說會不爽陳建州近日神隊友透露帶飛翔兄弟搭飛機時發現身旁乘客一邊瞄父子口中一邊念No陳建州說剛好好死死坐旁邊乘客還不耐煩碎念Come on然後把耳機戴乘客一連串舉動陳建州覺得受歧視提到會不爽這種感覺好像歧視爸爸歧視小孩喜歡小孩秒陳建州則說深夜一個復仇計劃黑暗中撇屁陳建州說完笑歪全場來賓逗得哈哈大笑說太幼稚【完整版】有神隊友帶孩子出國親子旅遊讚│神隊友 2019.05.13內容21分40秒中時電子報,原來黑人妹妹懷了雙胞胎圖翻攝自臉書藝人陳建州黑人范瑋琪范范結婚年育有一對雙胞胎兒子飛飛翔翔一家四口深得粉絲喜愛13日開心宣布喜訊透露家裡一對雙胞胎原來黑人妹妹懷了雙胞胎開心曬出家人合照表示我妹當媽媽⋯重點懷雙胞胎只見媽媽手指向妹妹微微隆起腹部氣氛相當歡樂黑人更笑說這應我媽今年震撼母親節禮物…感謝上帝安排將當舅舅喜悅藏不住消息公布吸引不少網友前來留言雙胞胎遺傳只能說家基因太強這也太狂恭喜黑人妹妹太猛恭喜期待飛飛翔翔幫忙顧雙胞胎樣子中時電子報,1
慘奪詐騙冒充電冠軍 中華郵政教辨別2019-05-13 12:13 聯合報 記者 聯合報 記者 曹悅華 即時報導近日內政部警政署165全民防騙網公布包含FAQ詐騙來電排名前十名名單中華郵政排第一中華郵政表示ATM只能提存款及轉帳具有退款解除分期設定身分驗證功能請民眾務必提高警覺中華郵政說FAQ詐騙來電排名周為單位統計月15日到21這段期間排第一中華郵政說長期以詐騙事件頻傳常有詐騙集團假冒中華郵政公司電話藉由開頭+號的電話號碼+886423542036+886423542030號碼欺騙民眾要求民眾自動櫃員機ATM解除分期付款設定遂行詐騙情事發生中華郵政表示ATM只能提存款及轉帳具有退款解除分期設定身分驗證功能請民眾務必提高警覺小心防範慎防受騙切勿聽信歹徒電話指示ATM操作功能將個資料金融卡密碼及存摺密碼告訴歹徒,汐止貨櫃車撞機車 女騎士遭輾斃頭顱破裂2019-05-13 10:50 聯合報 記者 聯合報 記者 李奕昕 即時報導新北市汐止區發生死亡車禍今天上午約點周姓男子55歲駕駛貨櫃車大同路一段台北市方向行駛擦撞陳姓女子24歲騎乘機車陳女貨櫃車輾過頭顱破裂當場死亡,0
同婚專法藍綠今上演表決大戰南北宗教界有志一同指出婚姻指一男一女成人自願結合婚姻生育教養子女功能應該立法保障一男一女婚姻關係這是信仰台灣目前全世界出生率最低離婚率第二高國家同婚專法台灣現況幫助這是政府應該要給答案基督教長老教會總會助理總幹事兼發言人陳義明表示〈牧函〉指出婚姻家庭人類社會重要制度婚姻指一男一女成人自願結合共同生活目的並獲社會法律認可獨特關係婚姻具有生育教養子女功能全世界各國皆立法保障一男一女婚姻關係陳義明表示牧函清楚表明同性性傾向屬天生說法未曾有科學之佐證確定存在同性性傾向認同且欲求發生同性性行則是聖經反天主教會台灣地區主教團祕書長陳科指出天主教婚姻定義是一男一女結合這是信仰國家決定政策自由要將同性婚姻合法化國家權力教會無法干涉但國家施政有責任國家發展保障人民生活著想同婚專法台灣現況幫助,明天立法院將表決同婚相關專法蔡英文總統臉書表示現在很難人人滿意紛擾畫下句點總統指出司法院釋字748號解釋施行法草案立法院進行表決議題三年討論社會過許不同意見家庭裡世代間宗教團體內部造成裂痕現在很難人人滿意紛擾畫下句點說謝謝行政院竭盡心力歧見中找到平衡點更謝謝民進黨立法院黨團一位成員面對壓力最終採取一致態度解決問題明天關鍵時刻我要拜託民進黨立委知道身處極大壓力逆境當中繼續堅持民進黨價值說台灣一個同胞手足歧異生活同一塊土地家人希望民主過程包容差異相互體諒取代對立相愛的相守這將台灣令人感動風景中時 ,1
